"Title","Year","Rated","Released","Runtime","Genre","Director","Writer","Actors","Awards","imdbRating","imdbID"
"Serendipity",2001,"PG-13","05 Oct 2001",90,"Comedy, Romance","Peter Chelsom","Marc Klein","John Cusack, Kate Beckinsale, Jeremy Piven, Bridget Moynahan","3 nominations.",6.9,"tt0240890"
"Kick-Ass",2010,"R","16 Apr 2010",117,"Action, Comedy","Matthew Vaughn","Jane Goldman","Aaron Taylor-Johnson, Garrett M. Brown, Evan Peters, Deborah Twiss","7 wins & 30 nominations.",7.8,"tt1250777"
"Zoolander",2001,"PG-13","28 Sep 2001",89,"Comedy","Ben Stiller","Drake Sather","Ben Stiller, Owen Wilson, Christine Taylor, Will Ferrell","1 win & 9 nominations.",6.6,"tt0196229"
"No Reservations",2007,"PG","27 Jul 2007",104,"Comedy, Drama, Romance","Scott Hicks","Carol Fuchs","Catherine Zeta-Jones, Aaron Eckhart, Abigail Breslin, Patricia Clarkson","1 nomination.",6.3,"tt0481141"
"Dracula 2000",2000,"R","22 Dec 2000",99,"Horror, Thriller","Patrick Lussier","Joel Soisson","Gerard Butler, Christopher Plummer, Jonny Lee Miller, Justine Waddell","1 nomination.",4.9,"tt0219653"
"Kick-Ass 2",2013,"R","16 Aug 2013",103,"Action, Comedy, Crime","Jeff Wadlow","Jeff Wadlow","Aaron Taylor-Johnson, Chloë Grace Moretz, Morris Chestnut, Claudia Lee","1 win.",6.8,"tt1650554"
"We Own the Night",2007,"R","12 Oct 2007",117,"Crime, Drama, Thriller","James Gray","James Gray","Joaquin Phoenix, Eva Mendes, Danny Hoch, Alex Veadov","5 nominations.",6.9,"tt0498399"
"The Spy Next Door",2010,"PG","15 Jan 2010",94,"Action, Comedy, Family","Brian Levant","Jonathan Bernstein","Jackie Chan, Amber Valletta, Madeline Carroll, Will Shadley","2 nominations.",5.4,"tt1273678"
"Just My Luck",2006,"PG-13","12 May 2006",103,"Comedy, Fantasy, Romance","Donald Petrie","I. Marlene King","Lindsay Lohan, Chris Pine, Samaire Armstrong, Bree Turner","6 nominations.",5.3,"tt0397078"
"Lost Souls",2000,"R","13 Oct 2000",97,"Drama, Horror, Thriller","Janusz Kaminski","Pierce Gardner","Winona Ryder, Ben Chaplin, Sarah Wynter, Philip Baker Hall","1 nomination.",4.8,"tt0160484"
"Winged Migration",2001,"G","12 Dec 2001",89,"Documentary","Jacques Perrin, Jacques Cluzaud, Michel Debats","Jean Dorst, Stéphane Durand, Guy Jarry, Valentine Marvel, Jacques Perrin, Francis Roux","Philippe Labro, Jacques Perrin","Nominated for 1 Oscar. Another 5 wins & 12 nominations.",8,"tt0301727"
"Knocked Up",2007,"R","01 Jun 2007",129,"Comedy, Drama, Romance","Judd Apatow","Judd Apatow","Seth Rogen, Katherine Heigl, Paul Rudd, Leslie Mann","4 wins & 14 nominations.",7.1,"tt0478311"
"My Sister's Keeper",2009,"PG-13","26 Jun 2009",109,"Drama","Nick Cassavetes","Jeremy Leven","Abigail Breslin, Walter Raney, Sofia Vassilieva, Cameron Diaz","3 wins & 3 nominations.",7.4,"tt1078588"
"Joyful Noise",2012,"PG-13","13 Jan 2012",118,"Comedy, Music","Todd Graff","Todd Graff","Queen Latifah, Dolly Parton, Keke Palmer, Jeremy Jordan","1 nomination.",5.6,"tt1710396"
"Notes on a Scandal",2006,"R","02 Feb 2007",92,"Drama, Thriller","Richard Eyre","Patrick Marber","Judi Dench, Cate Blanchett, Tom Georgeson, Michael Maloney","Nominated for 4 Oscars. Another 15 wins & 38 nominations.",7.5,"tt0465551"
"Rendition",2007,"R","19 Oct 2007",122,"Drama, Thriller","Gavin Hood","Kelley Sane","Jake Gyllenhaal, Reese Witherspoon, Meryl Streep, Alan Arkin","1 win & 2 nominations.",6.8,"tt0804522"
"Anonymous",2011,"PG-13","28 Oct 2011",130,"Drama, History, Thriller","Roland Emmerich","John Orloff","Rhys Ifans, Vanessa Redgrave, Sebastian Armesto, Rafe Spall","Nominated for 1 Oscar. Another 7 wins & 8 nominations.",6.9,"tt1521197"
"Limitless",2011,"PG-13","18 Mar 2011",105,"Mystery, Sci-Fi, Thriller","Neil Burger","Leslie Dixon","Bradley Cooper, Robert De Niro, Abbie Cornish, Andrew Howard","1 win & 6 nominations.",7.4,"tt1219289"
"The Sisterhood of the Traveling Pants 2",2008,"PG-13","06 Aug 2008",117,"Comedy, Drama, Romance","Sanaa Hamri","Elizabeth Chandler","Amber Tamblyn, Alexis Bledel, America Ferrera, Blake Lively","1 nomination.",6.2,"tt1018785"
"About a Boy",2002,"PG-13","17 May 2002",101,"Comedy, Drama, Romance","Chris Weitz, Paul Weitz","Nick Hornby","Hugh Grant, Nicholas Hoult, Sharon Small, Madison Cook","Nominated for 1 Oscar. Another 11 wins & 20 nominations.",7.1,"tt0276751"
"Spy Kids: All the Time in the World in 4D",2011,"PG","19 Aug 2011",89,"Action, Adventure, Comedy","Robert Rodriguez","Robert Rodriguez","Jessica Alba, Joel McHale, Rowan Blanchard, Mason Cook","4 nominations.",3.6,"tt1517489"
"Lucky Number Slevin",2006,"R","07 Apr 2006",110,"Crime, Drama, Mystery","Paul McGuigan","Jason Smilovic","Josh Hartnett, Bruce Willis, Lucy Liu, Morgan Freeman","4 wins & 3 nominations.",7.8,"tt0425210"
"Case 39",2009,"R","01 Oct 2010",109,"Horror, Mystery, Thriller","Christian Alvart","Ray Wright","Renée Zellweger, Jodelle Ferland, Ian McShane, Bradley Cooper","2 nominations.",6.2,"tt0795351"
"The Honeymooners",2005,"PG-13","10 Jun 2005",90,"Comedy, Drama, Family","John Schultz","Danny Jacobson, David Sheffield, Barry W. Blaustein, Don Rhymer","Cedric the Entertainer, Mike Epps, Gabrielle Union, Regina Hall","2 nominations.",3,"tt0373908"
"Formula 51",2001,"R","18 Oct 2002",93,"Action, Comedy, Crime","Ronny Yu","Stel Pavlou","Samuel L. Jackson, Nigel Whitmey, Robert Jezek, Emily Mortimer","1 nomination.",6.3,"tt0227984"
"Mindhunters",2004,"R","13 May 2005",106,"Crime, Mystery, Thriller","Renny Harlin","Wayne Kramer","Eion Bailey, Clifton Collins Jr., Will Kemp, Val Kilmer","2 nominations.",6.4,"tt0297284"
"The Statement",2003,"R","27 Feb 2004",120,"Thriller, Drama","Norman Jewison","Ronald Harwood","Michael Caine, Tilda Swinton, Jeremy Northam, Alan Bates","4 wins.",6.2,"tt0340376"
"Paul Blart: Mall Cop",2009,"PG","16 Jan 2009",91,"Action, Comedy, Crime","Steve Carr","Kevin James, Nick Bakay","Kevin James, Keir O'Donnell, Jayma Mays, Raini Rodriguez","1 win & 2 nominations.",5.2,"tt1114740"
"Freaky Friday",2003,"PG","06 Aug 2003",97,"Comedy, Family, Fantasy","Mark Waters","Mary Rodgers","Jamie Lee Curtis, Lindsay Lohan, Mark Harmon, Harold Gould","Nominated for 1 Golden Globe. Another 5 wins & 9 nominations.",6.1,"tt0322330"
"Open Range",2003,"R","15 Aug 2003",139,"Action, Romance, Western","Kevin Costner","Lauran Paine","Robert Duvall, Kevin Costner, Annette Bening, Michael Gambon","1 win & 4 nominations.",7.5,"tt0316356"
"Red Eye",2005,"PG-13","19 Aug 2005",85,"Action, Thriller","Wes Craven","Carl Ellsworth","Rachel McAdams, Cillian Murphy, Brian Cox, Laura Johnson","2 wins & 8 nominations.",6.5,"tt0421239"
"New Year's Eve",2011,"PG-13","09 Dec 2011",118,"Comedy, Romance","Garry Marshall","Katherine Fugate","Michelle Pfeiffer, Zac Efron, Charlotte Marshall-Fricker, Fiona Choi","8 nominations.",5.6,"tt1598822"
"Final Destination 2",2003,"R","31 Jan 2003",90,"Horror, Thriller","David R. Ellis","J. Mackye Gruber","Ali Larter, A.J. Cook, Michael Landes, David Paetkau","4 nominations.",6.2,"tt0309593"
"O Brother, Where Art Thou?",2000,"PG-13","02 Feb 2001",106,"Comedy, Crime","Joel Coen, Ethan Coen","Homer, Ethan Coen, Joel Coen","George Clooney, John Turturro, Tim Blake Nelson, John Goodman","Nominated for 2 Oscars. Another 7 wins & 31 nominations.",7.8,"tt0190590"
"In Good Company",2004,"PG-13","14 Jan 2005",109,"Comedy, Drama, Romance","Paul Weitz","Paul Weitz","Dennis Quaid, Topher Grace, Scarlett Johansson, Marg Helgenberger","1 win & 4 nominations.",6.5,"tt0385267"
"Brothers",2009,"R","04 Dec 2009",105,"Drama, Thriller, War","Jim Sheridan","David Benioff","Tobey Maguire, Jake Gyllenhaal, Natalie Portman, Sam Shepard","Nominated for 2 Golden Globes. Another 1 win & 10 nominations.",7.2,"tt0765010"
"Original Sin",2001,"R","03 Aug 2001",116,"Drama, Mystery, Romance","Michael Cristofer","Cornell Woolrich","Antonio Banderas, Angelina Jolie, Thomas Jane, Jack Thompson","1 nomination.",6,"tt0218922"
"The Curse of the Jade Scorpion",2001,"PG-13","24 Aug 2001",103,"Comedy, Crime, Mystery","Woody Allen","Woody Allen","John Tormey, John Schuck, Woody Allen, Elizabeth Berkley","1 win.",6.8,"tt0256524"
"The Fifth Estate",2013,"R","18 Oct 2013",128,"Biography, Drama, Thriller","Bill Condon","Daniel Domscheit-Berg","Peter Capaldi, David Thewlis, Anatole Taubman, Alexander Beyer","1 win & 1 nomination.",6.1,"tt1837703"
"The Constant Gardener",2005,"R","31 Aug 2005",129,"Drama, Mystery, Thriller","Fernando Meirelles","Jeffrey Caine","Ralph Fiennes, Rachel Weisz, Hubert Koundé, Danny Huston","Won 1 Oscar. Another 23 wins & 45 nominations.",7.5,"tt0387131"
"W.",2008,"PG-13","17 Oct 2008",129,"Biography, Drama, History","Oliver Stone","Stanley Weiser","Josh Brolin, Colin Hanks, Toby Jones, Dennis Boutsikaris","1 win & 4 nominations.",6.4,"tt1175491"
"The Passion of the Christ",2004,"R","25 Feb 2004",127,"Drama","Mel Gibson","Benedict Fitzgerald","Jim Caviezel, Maia Morgenstern, Christo Jivkov, Francesco De Vito","Nominated for 3 Oscars. Another 22 wins & 10 nominations.",7.1,"tt0335345"
"The Help",2011,"PG-13","10 Aug 2011",146,"Drama","Tate Taylor","Tate Taylor","Emma Stone, Viola Davis, Bryce Dallas Howard, Octavia Spencer","Won 1 Oscar. Another 46 wins & 68 nominations.",8.1,"tt1454029"
"Gran Torino",2008,"R","09 Jan 2009",116,"Drama","Clint Eastwood","Nick Schenk","Clint Eastwood, Christopher Carley, Bee Vang, Ahney Her","Nominated for 1 Golden Globe. Another 20 wins & 8 nominations.",8.2,"tt1205489"
"Taken",2008,"PG-13","30 Jan 2009",93,"Action, Crime, Thriller","Pierre Morel","Luc Besson, Robert Mark Kamen","Liam Neeson, Maggie Grace, Jon Gries, David Warshofsky","1 win & 1 nomination.",7.9,"tt0936501"
"Ride Along",2014,"PG-13","17 Jan 2014",99,"Action, Comedy","Tim Story","Greg Coolidge","Ice Cube, Kevin Hart, John Leguizamo, Bruce McGill","2 nominations.",6.3,"tt1408253"
"Legally Blonde 2: Red, White & Blonde",2003,"PG-13","02 Jul 2003",95,"Comedy","Charles Herman-Wurmfeld","Amanda Brown","Reese Witherspoon, Sally Field, Regina King, Jennifer Coolidge","3 wins & 3 nominations.",4.4,"tt0333780"
"Scooby-Doo 2: Monsters Unleashed",2004,"PG","26 Mar 2004",93,"Action, Adventure, Comedy","Raja Gosnell","William Hanna, James Gunn","Freddie Prinze Jr., Sarah Michelle Gellar, Matthew Lillard, Linda Cardellini","1 win & 2 nominations.",4.9,"tt0331632"
"Anchorman: The Legend of Ron Burgundy",2004,"PG-13","09 Jul 2004",94,"Comedy","Adam McKay","Will Ferrell, Adam McKay","Will Ferrell, Christina Applegate, Paul Rudd, Steve Carell","1 win & 9 nominations.",7.3,"tt0357413"
"Freddy vs. Jason",2003,"R","15 Aug 2003",97,"Horror, Thriller","Ronny Yu","Wes Craven, Damian Shannon, Mark Swift","Robert Englund, Ken Kirzinger, Monica Keena, Jason Ritter","3 wins & 6 nominations.",5.8,"tt0329101"
"Bridge to Terabithia",2007,"PG","16 Feb 2007",96,"Adventure, Drama, Family","Gabor Csupo","Jeff Stockwell","Josh Hutcherson, AnnaSophia Robb, Zooey Deschanel, Robert Patrick","6 wins & 2 nominations.",7.2,"tt0398808"
"Jimmy Neutron: Boy Genius",2001,"G","21 Dec 2001",82,"Animation, Action, Adventure","John A. Davis","John A. Davis","Megan Cavanagh, Mark DeCarlo, Debi Derryberry, Jeffrey Garcia","Nominated for 1 Oscar. Another 5 nominations.",6,"tt0268397"
"Cloverfield",2008,"PG-13","18 Jan 2008",85,"Action, Sci-Fi, Thriller","Matt Reeves","Drew Goddard","Lizzy Caplan, Jessica Lucas, T.J. Miller, Michael Stahl-David","5 wins & 11 nominations.",7.1,"tt1060277"
"Dear John",2010,"PG-13","05 Feb 2010",108,"Drama, Romance, War","Lasse Hallström","Jamie Linden","Channing Tatum, Amanda Seyfried, Richard Jenkins, Henry Thomas","1 win & 7 nominations.",6.2,"tt0989757"
"Parental Guidance",2012,"PG","25 Dec 2012",105,"Comedy","Andy Fickman","Lisa Addario, Joe Syracuse","Billy Crystal, Bette Midler, Marisa Tomei, Tom Everett Scott","1 win & 3 nominations.",6.1,"tt1047540"
"No Country for Old Men",2007,"R","21 Nov 2007",122,"Crime, Drama, Thriller","Ethan Coen, Joel Coen","Joel Coen","Tommy Lee Jones, Javier Bardem, Josh Brolin, Woody Harrelson","Won 4 Oscars. Another 110 wins & 51 nominations.",8.2,"tt0477348"
"Bridget Jones's Diary",2001,"R","13 Apr 2001",97,"Comedy, Drama, Romance","Sharon Maguire","Helen Fielding","Renée Zellweger, Gemma Jones, Celia Imrie, James Faulkner","Nominated for 1 Oscar. Another 9 wins & 29 nominations.",6.7,"tt0243155"
"Chocolat",2000,"PG-13","19 Jan 2001",121,"Drama, Romance","Lasse Hallström","Joanne Harris","Alfred Molina, Carrie-Anne Moss, Aurelien Parent Koenig, Antonio Gil","Nominated for 5 Oscars. Another 8 wins & 29 nominations.",7.3,"tt0241303"
"No Strings Attached",2011,"R","21 Jan 2011",108,"Comedy, Romance","Ivan Reitman","Elizabeth Meriwether","Natalie Portman, Ashton Kutcher, Kevin Kline, Cary Elwes","2 wins & 5 nominations.",6.2,"tt1411238"
"Romeo Must Die",2000,"R","22 Mar 2000",115,"Action, Crime, Thriller","Andrzej Bartkowiak","Mitchell Kapner","Jet Li, Aaliyah, Isaiah Washington, Russell Wong","1 win & 7 nominations.",6,"tt0165929"
"Final Destination 3",2006,"R","10 Feb 2006",93,"Horror, Thriller","James Wong","Glen Morgan, James Wong, Jeffrey Reddick","Mary Elizabeth Winstead, Ryan Merriman, Kris Lemche, Alexz Johnson","6 nominations.",5.8,"tt0414982"
"Tyler Perry's A Madea Christmas",2013,"PG-13","13 Dec 2013",100,"Comedy, Drama","Tyler Perry","Tyler Perry","Tyler Perry, Anna Maria Horsford, Tika Sumpter, Eric Lively","1 win & 6 nominations.",4,"tt2609758"
"Finding Neverland",2004,"PG","24 Nov 2004",106,"Biography, Drama, Family","Marc Forster","Allan Knee","Johnny Depp, Kate Winslet, Julie Christie, Radha Mitchell","Won 1 Oscar. Another 18 wins & 57 nominations.",7.8,"tt0308644"
"The Grey",2011,"R","27 Jan 2012",117,"Adventure, Drama, Thriller","Joe Carnahan","Joe Carnahan","Liam Neeson, Frank Grillo, Dermot Mulroney, Dallas Roberts","4 wins & 2 nominations.",6.8,"tt1601913"
"Hide and Seek",2005,"R","28 Jan 2005",101,"Horror, Mystery, Thriller","John Polson","Ari Schlossberg","Robert De Niro, Dakota Fanning, Famke Janssen, Elisabeth Shue","1 win & 4 nominations.",5.9,"tt0382077"
"The House Bunny",2008,"PG-13","22 Aug 2008",97,"Comedy, Romance","Fred Wolf","Karen McCullah, Kirsten Smith","Anna Faris, Colin Hanks, Emma Stone, Kat Dennings","1 nomination.",5.5,"tt0852713"
"Agent Cody Banks",2003,"PG","14 Mar 2003",102,"Action, Adventure, Comedy","Harald Zwart","Ashley Miller","Frankie Muniz, Hilary Duff, Angie Harmon, Keith David","4 nominations.",5,"tt0313911"
"Nanny McPhee",2005,"PG","27 Jan 2006",97,"Comedy, Family, Fantasy","Kirk Jones","Emma Thompson","Emma Thompson, Colin Firth, Kelly Macdonald, Thomas Brodie-Sangster","2 wins & 4 nominations.",6.6,"tt0396752"
"The Hours",2002,"PG-13","24 Jan 2003",114,"Drama","Stephen Daldry","Michael Cunningham","Meryl Streep, Julianne Moore, Nicole Kidman, Ed Harris","Won 1 Oscar. Another 41 wins & 72 nominations.",7.6,"tt0274558"
"There Will Be Blood",2007,"R","25 Jan 2008",158,"Drama","Paul Thomas Anderson","Paul Thomas Anderson","Daniel Day-Lewis, Martin Stringer, Matthew Braden Stringer, Jacob Stringer","Won 2 Oscars. Another 74 wins & 58 nominations.",8.1,"tt0469494"
"Rugrats Go Wild",2003,"PG","13 Jun 2003",80,"Animation, Adventure, Comedy","John Eng, Norton Virgien","Kate Boutilier","Elizabeth Daily, Nancy Cartwright, Kath Soucie, Dionne Quan","2 nominations.",5.5,"tt0337711"
"The Sisterhood of the Traveling Pants",2005,"PG","01 Jun 2005",119,"Comedy, Drama","Ken Kwapis","Ann Brashares","Amber Tamblyn, Alexis Bledel, America Ferrera, Blake Lively","1 win & 14 nominations.",6.6,"tt0403508"
"Undercover Brother",2002,"PG-13","31 May 2002",86,"Action, Comedy","Malcolm D. Lee","John Ridley","Eddie Griffin, Chris Kattan, Denise Richards, Aunjanue Ellis","1 win & 7 nominations.",5.8,"tt0279493"
"August: Osage County",2013,"R","10 Jan 2014",121,"Drama","John Wells","Tracy Letts","Meryl Streep, Julia Roberts, Chris Cooper, Ewan McGregor","Nominated for 2 Oscars. Another 8 wins & 34 nominations.",7.4,"tt1322269"
"Beauty Shop",2005,"PG-13","30 Mar 2005",105,"Comedy","Bille Woodruff","Elizabeth Hunter","Queen Latifah, Alicia Silverstone, Andie MacDowell, Alfre Woodard","13 nominations.",5.4,"tt0388500"
"What a Girl Wants",2003,"PG","04 Apr 2003",105,"Comedy, Drama, Romance","Dennie Gordon","William Douglas-Home","Amanda Bynes, Colin Firth, Kelly Preston, Eileen Atkins","1 win.",5.8,"tt0286788"
"Jeepers Creepers II",2003,"R","29 Aug 2003",104,"Horror, Thriller","Victor Salva","Victor Salva, Victor Salva","Ray Wise, Jonathan Breck, Garikayi Mutambirwa, Eric Nenninger","5 nominations.",5.5,"tt0301470"
"Good Luck Chuck",2007,"R","21 Sep 2007",96,"Comedy, Drama, Romance","Mark Helfrich","Josh Stolberg","Connor Price, Troy Gentile, Mackenzie Mowat, Sasha Pieterse","3 nominations.",5.6,"tt0452625"
"Cradle 2 the Grave",2003,"R","28 Feb 2003",101,"Action, Crime, Drama","Andrzej Bartkowiak","John O'Brien","Jet Li, DMX, Anthony Anderson, Kelly Hu","6 nominations.",5.7,"tt0306685"
"She's the Man",2006,"PG-13","17 Mar 2006",105,"Comedy, Romance","Andy Fickman","Ewan Leslie","Amanda Bynes, Channing Tatum, Laura Ramsey, Vinnie Jones","2 wins & 2 nominations.",6.4,"tt0454945"
"Mr. Bean's Holiday",2007,"PG","24 Aug 2007",90,"Comedy, Family","Steve Bendelack","Rowan Atkinson","Rowan Atkinson, Steve Pemberton, Lily Atkinson, Preston Nyman","2 nominations.",6.2,"tt0453451"
"August Rush",2007,"PG","21 Nov 2007",114,"Drama, Music","Kirsten Sheridan","Nick Castle","Freddie Highmore, Keri Russell, Jonathan Rhys Meyers, Terrence Howard","Nominated for 1 Oscar. Another 4 wins & 9 nominations.",7.6,"tt0426931"
"Anacondas: The Hunt for the Blood Orchid",2004,"PG-13","27 Aug 2004",97,"Action, Adventure, Horror","Dwight H. Little","Hans Bauer, Jim Cash, Jack Epps Jr., Hans Bauer","Johnny Messner, KaDee Strickland, Matthew Marsden, Nicholas Gonzalez","1 nomination.",4.5,"tt0366174"
"Crocodile Dundee in Los Angeles",2001,"PG","20 Apr 2001",92,"Adventure, Comedy","Simon Wincer","Paul Hogan, Matt Berry, Eric Abrams","Paul Hogan, Linda Kozlowski, Jere Burns, Jonathan Banks","2 nominations.",4.7,"tt0231402"
"Don't Be Afraid of the Dark",2010,"R","26 Aug 2011",99,"Fantasy, Horror, Thriller","Troy Nixey","Guillermo del Toro, Nigel McKeand","Katie Holmes, Guy Pearce, Bailee Madison, Jack Thompson","1 win & 1 nomination.",5.6,"tt1270761"
"The Losers",2010,"PG-13","23 Apr 2010",97,"Action, Crime, Drama","Sylvain White","Peter Berg","Jeffrey Dean Morgan, Zoe Saldana, Chris Evans, Idris Elba","1 win & 5 nominations.",6.4,"tt0480255"
"A Lot Like Love",2005,"PG-13","22 Apr 2005",107,"Comedy, Drama, Romance","Nigel Cole","Colin Patrick Lynch","Amanda Peet, Ashton Kutcher, Taryn Manning, Aimee Garcia","1 win & 3 nominations.",6.6,"tt0391304"
"Shark Night 3D",2011,"PG-13","02 Sep 2011",90,"Horror, Thriller","David R. Ellis","Will Hayes, Jesse Studenberg","Sara Paxton, Dustin Milligan, Chris Carmack, Katharine McPhee","1 win.",3.9,"tt1633356"
"Punch-Drunk Love",2002,"R","01 Nov 2002",95,"Comedy, Drama, Romance","Paul Thomas Anderson","Paul Thomas Anderson","Adam Sandler, Jason Andrews, Don McManus, Emily Watson","Nominated for 1 Golden Globe. Another 16 wins & 17 nominations.",7.3,"tt0272338"
"EuroTrip",2004,"R","20 Feb 2004",93,"Adventure, Comedy","Jeff Schaffer, Alec Berg, David Mandel","Alec Berg, David Mandel, Jeff Schaffer","Scott Mechlowicz, Jacob Pitts, Kristin Kreuk, Cathy Meils","2 nominations.",6.6,"tt0356150"
"The Ruins",2008,"R","04 Apr 2008",90,"Horror, Thriller","Carter Smith","Scott B. Smith","Jonathan Tucker, Jena Malone, Laura Ramsey, Shawn Ashmore","2 nominations.",5.9,"tt0963794"
"The Counselor",2013,"R","25 Oct 2013",117,"Crime, Drama, Thriller","Ridley Scott","Cormac McCarthy","Michael Fassbender, Penélope Cruz, Cameron Diaz, Javier Bardem","2 nominations.",5.5,"tt2193215"
"Unaccompanied Minors",2006,"PG","08 Dec 2006",90,"Adventure, Comedy, Family","Paul Feig","Jacob Meszaros, Mya Stark","Lewis Black, Wilmer Valderrama, Tyler James Williams, Dyllan Christopher","2 nominations.",4.9,"tt0488658"
"Half Past Dead",2002,"PG-13","15 Nov 2002",98,"Action, Crime, Thriller","Don Michael Paul","Don Michael Paul","Steven Seagal, Morris Chestnut, Ja Rule, Nia Peeples","3 nominations.",4.5,"tt0297162"
"The Greatest Game Ever Played",2005,"PG","30 Sep 2005",120,"Drama, History, Sport","Bill Paxton","Mark Frost","James Paxton, Tom Rack, Armand Laroche, Peter Hurley","3 nominations.",7.5,"tt0388980"
"The Box",2009,"PG-13","06 Nov 2009",115,"Drama, Mystery, Sci-Fi","Richard Kelly","Richard Kelly","Cameron Diaz, James Marsden, Frank Langella, James Rebhorn","6 nominations.",5.6,"tt0362478"
"The Next Best Thing",2000,"PG-13","03 Mar 2000",108,"Comedy, Drama, Romance","John Schlesinger","Tom Ropelewski","Madonna, Rupert Everett, Benjamin Bratt, Illeana Douglas","1 win & 7 nominations.",4.6,"tt0156841"
"My Soul to Take",2010,"R","08 Oct 2010",107,"Horror, Mystery, Thriller","Wes Craven","Wes Craven","Max Thieriot, John Magaro, Denzel Whitaker, Zena Grey","1 nomination.",4.7,"tt0872230"
"The Girl Next Door",2004,"R","09 Apr 2004",108,"Comedy, Drama, Romance","Luke Greenfield","David Wagner","Emile Hirsch, Elisha Cuthbert, Timothy Olyphant, James Remar","4 nominations.",6.8,"tt0265208"
"Stealing Harvard",2002,"PG-13","13 Sep 2002",85,"Comedy, Crime","Bruce McCulloch","Martin Hynes","Jason Lee, Tom Green, Leslie Mann, Megan Mullally","1 nomination.",5,"tt0265808"
"Hot Rod",2007,"PG-13","03 Aug 2007",88,"Comedy","Akiva Schaffer","Pam Brady","Andy Samberg, Jorma Taccone, Bill Hader, Danny McBride","1 win & 1 nomination.",6.7,"tt0787475"
"Warrior",2011,"PG-13","09 Sep 2011",140,"Drama, Sport","Gavin O'Connor","Gavin O'Connor","Joel Edgerton, Tom Hardy, Nick Nolte, Jennifer Morrison","Nominated for 1 Oscar. Another 2 wins & 10 nominations.",8.3,"tt1291584"
"Cirque du Soleil: Worlds Away",2012,"PG","21 Dec 2012",91,"Fantasy","Andrew Adamson","Andrew Adamson","Erica Linz, Igor Zaripov, Lutz Halbhubner, John Clarke","1 nomination.",6.7,"tt1792647"
"The Conspirator",2010,"PG-13","15 Apr 2011",122,"Crime, Drama, History","Robert Redford","James D. Solomon, James D. Solomon","James McAvoy, Robin Wright, Kevin Kline, Evan Rachel Wood","1 win & 2 nominations.",7,"tt0968264"
"Stop-Loss",2008,"R","28 Mar 2008",112,"Drama, War","Kimberly Peirce","Mark Richard, Kimberly Peirce","Ryan Phillippe, Joseph Gordon-Levitt, Rob Brown, Channing Tatum","2 wins & 3 nominations.",6.5,"tt0489281"
"Abandon",2002,"PG-13","18 Oct 2002",99,"Drama, Music, Mystery","Stephen Gaghan","Stephen Gaghan","Katie Holmes, Benjamin Bratt, Charlie Hunnam, Zooey Deschanel","1 nomination.",4.8,"tt0267248"
"Possession",2002,"PG-13","30 Aug 2002",102,"Romance, Drama, Mystery","Neil LaBute","A.S. Byatt","Gwyneth Paltrow, Aaron Eckhart, Jeremy Northam, Jennifer Ehle","1 nomination.",6.4,"tt0256276"
"The Road",2009,"R","02 Dec 2009",111,"Adventure, Drama","John Hillcoat","Cormac McCarthy","Viggo Mortensen, Kodi Smit-McPhee, Robert Duvall, Guy Pearce","Nominated for 1 BAFTA Film Award. Another 2 wins & 15 nominations.",7.3,"tt0898367"
"The Hoax",2006,"R","20 Apr 2007",116,"Comedy, Drama","Lasse Hallström","William Wheeler","David Aaron Baker, John Carter, Judi Barton, Raul Julia Jr.","1 win & 2 nominations.",6.7,"tt0462338"
"Say It Isn't So",2001,"R","23 Mar 2001",95,"Comedy, Romance","J.B. Rogers","Peter Gaulke, Gerry Swallow","Chris Klein, Heather Graham, Orlando Jones, Sally Field","1 nomination.",4.9,"tt0239949"
"The World's Fastest Indian",2005,"PG-13","13 Oct 2005",127,"Biography, Drama, Sport","Roger Donaldson","Roger Donaldson","Anthony Hopkins, Iain Rea, Tessa Mitchell, Aaron Murphy","10 wins & 5 nominations.",7.9,"tt0412080"
"Blindness",2008,"R","03 Oct 2008",121,"Drama, Mystery, Sci-Fi","Fernando Meirelles","José Saramago","Yûsuke Iseya, Jason Bermingham, Eduardo Semerjian, Don McKellar","12 wins & 18 nominations.",6.6,"tt0861689"
"BloodRayne",2005,"R","06 Jan 2006",95,"Action, Adventure, Fantasy","Uwe Boll","Guinevere Turner","Kristanna Loken, Michael Madsen, Matthew Davis, Will Sanderson","6 nominations.",2.8,"tt0383222"
"Me and Orson Welles",2008,"PG-13","04 Dec 2009",114,"Drama","Richard Linklater","Holly Gent Palmo","Christian McKay, Zac Efron, Zoe Kazan, Megan Maczko","Nominated for 1 BAFTA Film Award. Another 7 wins & 13 nominations.",6.8,"tt1175506"
"Where the Truth Lies",2005,"R","07 Oct 2005",107,"Crime, Drama, Mystery","Atom Egoyan","Atom Egoyan","Kevin Bacon, Colin Firth, Alison Lohman, David Hayman","2 wins & 10 nominations.",6.6,"tt0373450"
"On the Road",2012,"R","23 May 2012",124,"Adventure, Drama","Walter Salles","Jack Kerouac","Sam Riley, Garrett Hedlund, Kristen Stewart, Amy Adams","2 wins & 3 nominations.",6.1,"tt0337692"
"Old School",2003,"R","21 Feb 2003",91,"Comedy","Todd Phillips","Court Crandall","Luke Wilson, Will Ferrell, Vince Vaughn, Jeremy Piven","4 nominations.",7.2,"tt0302886"
"Rocky Balboa",2006,"PG","20 Dec 2006",102,"Drama, Sport","Sylvester Stallone","Sylvester Stallone, Sylvester Stallone","Sylvester Stallone, Burt Young, Antonio Tarver, Geraldine Hughes","1 nomination.",7.2,"tt0479143"
"The Whole Nine Yards",2000,"R","18 Feb 2000",98,"Comedy, Crime","Jonathan Lynn","Mitchell Kapner","Bruce Willis, Matthew Perry, Rosanna Arquette, Michael Clarke Duncan","4 nominations.",6.7,"tt0190138"
"Return to Me",2000,"PG","07 Apr 2000",115,"Comedy, Drama, Romance","Bonnie Hunt","Bonnie Hunt","David Duchovny, Minnie Driver, Carroll O'Connor, Robert Loggia","1 win & 2 nominations.",6.9,"tt0122459"
"The Men Who Stare at Goats",2009,"R","06 Nov 2009",94,"Comedy, War","Grant Heslov","Peter Straughan","George Clooney, Ewan McGregor, Jeff Bridges, Kevin Spacey","1 win & 1 nomination.",6.3,"tt1234548"
"Nurse Betty",2000,"R","08 Sep 2000",110,"Comedy, Crime, Drama","Neil LaBute","John C. Richards","Morgan Freeman, Renée Zellweger, Chris Rock, Greg Kinnear","Won 1 Golden Globe. Another 5 wins & 13 nominations.",6.3,"tt0171580"
"Piranha 3D",2010,"R","20 Aug 2010",88,"Comedy, Horror","Alexandre Aja","Pete Goldfinger, Josh Stolberg","Richard Dreyfuss, Ving Rhames, Elisabeth Shue, Christopher Lloyd","1 nomination.",5.6,"tt0464154"
