"Title","Year","Rated","Released","Runtime","Genre","Director","Writer","Actors","Awards","imdbRating","imdbID"
"The Shaggy Dog",2006,"PG","10 Mar 2006",98,"Comedy, Family, Fantasy","Brian Robbins","Cormac Wibberley","Tim Allen, Kristin Davis, Zena Grey, Spencer Breslin","3 nominations.",4.4,"tt0393735"
"Hellboy",2004,"PG-13","02 Apr 2004",122,"Action, Adventure, Fantasy","Guillermo del Toro","Guillermo del Toro","Ron Perlman, John Hurt, Selma Blair, Rupert Evans","8 wins & 8 nominations.",6.8,"tt0167190"
"ParaNorman",2012,"PG","17 Aug 2012",92,"Animation, Adventure, Comedy","Chris Butler, Sam Fell","Chris Butler","Kodi Smit-McPhee, Tucker Albrizzi, Anna Kendrick, Casey Affleck","Nominated for 1 Oscar. Another 17 wins & 23 nominations.",7,"tt1623288"
"Paycheck",2003,"PG-13","25 Dec 2003",119,"Action, Mystery, Sci-Fi","John Woo","Philip K. Dick","Ben Affleck, Aaron Eckhart, Uma Thurman, Paul Giamatti","2 wins & 2 nominations.",6.2,"tt0338337"
"The Tale of Despereaux",2008,"G","19 Dec 2008",93,"Adventure, Animation, Comedy","Sam Fell, Robert Stevenhagen","Kate DiCamillo","Matthew Broderick, Dustin Hoffman, Emma Watson, Tracey Ullman","1 win & 8 nominations.",6.1,"tt0420238"
"The Tuxedo",2002,"PG-13","27 Sep 2002",98,"Action, Comedy, Sci-Fi","Kevin Donovan","Phil Hay","Jackie Chan, Jennifer Love Hewitt, Jason Isaacs, Debi Mazar","2 wins & 1 nomination.",5.2,"tt0290095"
"Jack Ryan: Shadow Recruit",2014,"PG-13","17 Jan 2014",105,"Action, Crime, Mystery","Kenneth Branagh","Adam Cozad, David Koepp, Tom Clancy","Chris Pine, Keira Knightley, Kevin Costner, Kenneth Branagh","1 nomination.",6.5,"tt1205537"
"Miss Congeniality 2: Armed and Fabulous",2005,"PG-13","24 Mar 2005",115,"Action, Comedy, Crime","John Pasquin","Marc Lawrence, Marc Lawrence","Sandra Bullock, Regina King, Enrique Murciano, William Shatner","2 wins & 2 nominations.",4.9,"tt0385307"
"Shooter",2007,"R","23 Mar 2007",124,"Action, Crime, Drama","Antoine Fuqua","Jonathan Lemkin","Mark Wahlberg, Michael Peña, Danny Glover, Kate Mara","1 nomination.",7.2,"tt0822854"
"Gangster Squad",2013,"R","11 Jan 2013",113,"Action, Crime, Drama","Ruben Fleischer","Will Beall, Paul Lieberman","Sean Penn, Holt McCallany, Wade Williams, James Landry Hébert","1 win & 1 nomination.",6.8,"tt1321870"
"Year One",2009,"PG-13","19 Jun 2009",97,"Adventure, Comedy","Harold Ramis","Harold Ramis","Jack Black, Michael Cera, Oliver Platt, David Cross","1 nomination.",4.9,"tt1045778"
"Edge of Darkness",2010,"R","29 Jan 2010",117,"Crime, Drama, Mystery","Martin Campbell","William Monahan","Mel Gibson, Ray Winstone, Danny Huston, Bojana Novakovic","1 nomination.",6.6,"tt1226273"
"Star Trek: Nemesis",2002,"PG-13","13 Dec 2002",116,"Action, Adventure, Sci-Fi","Stuart Baird","Gene Roddenberry","Patrick Stewart, Jonathan Frakes, Brent Spiner, LeVar Burton","1 win & 4 nominations.",6.4,"tt0253754"
"Reign of Fire",2002,"PG-13","12 Jul 2002",101,"Action, Adventure, Fantasy","Rob Bowman","Gregg Chabot","Christian Bale, Matthew McConaughey, Izabella Scorupco, Gerard Butler","1 win & 2 nominations.",6.2,"tt0253556"
"Planet 51",2009,"PG","20 Nov 2009",91,"Animation, Adventure, Comedy","Jorge Blanco, Javier Abad, Marcos Martínez","Javier Abad, Joe Stillman","Jessica Biel, John Cleese, Gary Oldman, Dwayne Johnson","2 wins & 4 nominations.",6.1,"tt0762125"
"Righteous Kill",2008,"R","12 Sep 2008",101,"Action, Crime, Drama","Jon Avnet","Russell Gewirtz","Robert De Niro, Al Pacino, 50 Cent, Carla Gugino","1 nomination.",6,"tt1034331"
"State of Play",2009,"PG-13","17 Apr 2009",127,"Drama, Mystery","Kevin Macdonald","Matthew Michael Carnahan","Russell Crowe, Ben Affleck, Rachel McAdams, Helen Mirren","2 wins & 2 nominations.",7.1,"tt0473705"
"The Sentinel",2006,"PG-13","21 Apr 2006",108,"Action, Crime, Thriller","Clark Johnson","George Nolfi","Michael Douglas, Kiefer Sutherland, Eva Longoria, Martin Donovan","2 nominations.",6.1,"tt0443632"
"Trouble with the Curve",2012,"PG-13","21 Sep 2012",111,"Drama, Sport","Robert Lorenz","Randy Brown","Clint Eastwood, Chelcie Ross, Raymond Anthony Thomas, Ed Lauter","2 wins.",6.8,"tt2083383"
"Intolerable Cruelty",2003,"PG-13","10 Oct 2003",100,"Comedy, Crime, Romance","Joel Coen, Ethan Coen","Robert Ramsey","George Clooney, Catherine Zeta-Jones, Geoffrey Rush, Cedric the Entertainer","3 nominations.",6.3,"tt0138524"
"Almost Famous",2000,"R","13 Sep 2000",122,"Drama, Music","Cameron Crowe","Cameron Crowe","Billy Crudup, Frances McDormand, Kate Hudson, Jason Lee","Won 1 Oscar. Another 51 wins & 80 nominations.",8,"tt0181875"
"The Soloist",2009,"PG-13","24 Apr 2009",117,"Biography, Drama, Music","Joe Wright","Susannah Grant","Jamie Foxx, Robert Downey Jr., Catherine Keener, Tom Hollander","1 win & 3 nominations.",6.7,"tt0821642"
"The Mortal Instruments: City of Bones",2013,"PG-13","21 Aug 2013",130,"Action, Adventure, Fantasy","Harald Zwart","Jessica Postigo","Lily Collins, Jamie Campbell Bower, Kevin Zegers, Jemima West","5 wins & 3 nominations.",6,"tt1538403"
"The Legend of Bagger Vance",2000,"PG-13","03 Nov 2000",126,"Drama, Fantasy, Sport","Robert Redford","Steven Pressfield","Will Smith, Matt Damon, Charlize Theron, Bruce McGill","2 wins & 10 nominations.",6.7,"tt0146984"
"Dragonfly",2002,"PG-13","22 Feb 2002",104,"Drama, Fantasy, Mystery","Tom Shadyac","Brandon Camp","Kevin Costner, Susanna Thompson, Joe Morton, Ron Rifkin","1 nomination.",6,"tt0259288"
"Priest",2011,"PG-13","13 May 2011",87,"Action, Fantasy, Horror","Scott Stewart","Cory Goodman, Min-Woo Hyung","Paul Bettany, Karl Urban, Cam Gigandet, Maggie Q","2 nominations.",5.7,"tt0822847"
"xXx: State of the Union",2005,"PG-13","29 Apr 2005",101,"Action, Crime, Adventure","Lee Tamahori","Rich Wilkes, Simon Kinberg","Willem Dafoe, Samuel L. Jackson, Ice Cube, Scott Speedman","1 nomination.",4.2,"tt0329774"
"Sinbad: Legend of the Seven Seas",2003,"PG","02 Jul 2003",86,"Adventure, Fantasy, Animation","Patrick Gilmore, Tim Johnson","John Logan","Brad Pitt, Catherine Zeta-Jones, Michelle Pfeiffer, Joseph Fiennes","8 nominations.",6.6,"tt0165982"
"Dark Water",2005,"PG-13","08 Jul 2005",105,"Drama, Horror, Thriller","Walter Salles","Kôji Suzuki","Jennifer Connelly, John C. Reilly, Tim Roth, Dougray Scott","5 nominations.",5.5,"tt0382628"
"The Avengers",2012,"PG-13","04 May 2012",143,"Action, Sci-Fi","Joss Whedon","Joss Whedon","Robert Downey Jr., Chris Evans, Mark Ruffalo, Chris Hemsworth","Nominated for 1 Oscar. Another 24 wins & 55 nominations.",8.2,"tt0848228"
"The Black Dahlia",2006,"R","15 Sep 2006",121,"Crime, Drama, Mystery","Brian De Palma","Josh Friedman","Josh Hartnett, Scarlett Johansson, Aaron Eckhart, Hilary Swank","Nominated for 1 Oscar. Another 2 wins & 7 nominations.",5.6,"tt0387877"
"The Last Castle",2001,"R","19 Oct 2001",131,"Action, Drama, Thriller","Rod Lurie","David Scarpa","Robert Redford, James Gandolfini, Mark Ruffalo, Steve Burton","1 win & 3 nominations.",6.9,"tt0272020"
"Flyboys",2006,"PG-13","22 Sep 2006",140,"Action, Adventure, Drama","Tony Bill","Phil Sears","James Franco, Scott Hazell, Mac McDonald, Philip Winchester","2 wins & 3 nominations.",6.6,"tt0454824"
"Meet Dave",2008,"PG","11 Jul 2008",90,"Adventure, Comedy, Family","Brian Robbins","Rob Greenberg, Bill Corbett","Eddie Murphy, Elizabeth Banks, Gabrielle Union, Scott Caan","1 win & 3 nominations.",4.9,"tt0765476"
"The Great Raid",2005,"R","12 Aug 2005",132,"Action, Drama, War","John Dahl","William B. Breuer","Benjamin Bratt, James Franco, Robert Mammone, Max Martini","1 nomination.",6.7,"tt0326905"
"Beyond Borders",2003,"R","24 Oct 2003",127,"Adventure, Drama, Romance","Martin Campbell","Caspian Tredwell-Owen","Angelina Jolie, Clive Owen, Teri Polo, Linus Roache","2 nominations.",6.4,"tt0294357"
"Red Tails",2012,"PG-13","20 Jan 2012",125,"Action, Adventure, Drama","Anthony Hemingway","John Ridley","Terrence Howard, Cuba Gooding Jr., Nate Parker, David Oyelowo","2 wins & 8 nominations.",5.9,"tt0485985"
"Just Like Heaven",2005,"PG-13","16 Sep 2005",95,"Comedy, Fantasy, Romance","Mark Waters","Peter Tolan","Reese Witherspoon, Mark Ruffalo, Donal Logue, Dina Waters","1 win & 1 nomination.",6.8,"tt0425123"
"The Internship",2013,"PG-13","07 Jun 2013",119,"Comedy","Shawn Levy","Vince Vaughn","Vince Vaughn, Owen Wilson, Rose Byrne, Aasif Mandvi","1 nomination.",6.4,"tt2234155"
"The Flintstones in Viva Rock Vegas",2000,"PG","28 Apr 2000",90,"Comedy, Family, Romance","Brian Levant","William Hanna, Deborah Kaplan, Harry Elfont, Jim Cash, Jack Epps Jr.","Mark Addy, Stephen Baldwin, Kristen Johnston, Jane Krakowski","5 nominations.",3.5,"tt0158622"
"Leatherheads",2008,"PG-13","04 Apr 2008",114,"Comedy, Drama, Romance","George Clooney","Duncan Brantley, Rick Reilly","John Krasinski, David de Vries, Rick Forrester, Craig S. Harper","2 nominations.",6.1,"tt0379865"
"Did You Hear About the Morgans?",2009,"PG-13","18 Dec 2009",103,"Comedy, Drama, Romance","Marc Lawrence","Marc Lawrence","Hugh Grant, Sarah Jessica Parker, Natalia Klimas, Vincenzo Amato","1 nomination.",4.6,"tt1314228"
"Sex and the City",2008,"R","30 May 2008",145,"Comedy, Drama, Romance","Michael Patrick King","Michael Patrick King, Candace Bushnell","Sarah Jessica Parker, Kim Cattrall, Kristin Davis, Cynthia Nixon","1 win & 11 nominations.",5.4,"tt1000774"
"After the Sunset",2004,"PG-13","12 Nov 2004",97,"Action, Comedy, Crime","Brett Ratner","Paul Zbyszewski","Pierce Brosnan, Salma Hayek, Woody Harrelson, Don Cheadle","1 nomination.",6.3,"tt0367479"
"Captain Corelli's Mandolin",2001,"R","17 Aug 2001",131,"Drama, Music, Romance","John Madden","Shawn Slovo","Penélope Cruz, John Hurt, Christian Bale, Irene Papas","4 nominations.",5.9,"tt0238112"
"Anger Management",2003,"PG-13","11 Apr 2003",106,"Comedy","Peter Segal","David Dorfman","Adam Sandler, Jack Nicholson, Marisa Tomei, Luis Guzmán","2 wins & 5 nominations.",6.2,"tt0305224"
"The Pacifier",2005,"PG","04 Mar 2005",95,"Action, Comedy, Drama","Adam Shankman","Thomas Lennon, Robert Ben Garant","Vin Diesel, Lauren Graham, Faith Ford, Brittany Snow","1 win & 4 nominations.",5.5,"tt0395699"
"Walking Tall",2004,"PG-13","02 Apr 2004",86,"Action, Crime","Kevin Bray","Mort Briskin","Michael Bowen, Johnny Knoxville, Dwayne Johnson, Neal McDonough","2 nominations.",6.2,"tt0351977"
"Alvin and the Chipmunks",2007,"PG","14 Dec 2007",92,"Animation, Comedy, Family","Tim Hill","Jon Vitti","Jason Lee, David Cross, Cameron Richardson, Jane Lynch","2 wins & 1 nomination.",5.3,"tt0952640"
"Hitch",2005,"PG-13","11 Feb 2005",118,"Comedy, Romance","Andy Tennant","Kevin Bisch","Will Smith, Eva Mendes, Kevin James, Amber Valletta","3 wins & 24 nominations.",6.7,"tt0386588"
"Meet the Parents",2000,"PG-13","06 Oct 2000",108,"Comedy, Romance","Jay Roach","Greg Glienna, Mary Ruth Clarke, Greg Glienna","Robert De Niro, Ben Stiller, Teri Polo, Blythe Danner","Nominated for 1 Oscar. Another 7 wins & 14 nominations.",7,"tt0212338"
"The Pursuit of Happyness",2006,"PG-13","15 Dec 2006",117,"Biography, Drama","Gabriele Muccino","Steve Conrad","Will Smith, Jaden Smith, Thandie Newton, Brian Howe","Nominated for 1 Oscar. Another 11 wins & 18 nominations.",7.9,"tt0454921"
"Captain Phillips",2013,"PG-13","11 Oct 2013",134,"Biography, Drama, Thriller","Paul Greengrass","Billy Ray","Tom Hanks, Catherine Keener, Barkhad Abdi, Barkhad Abdirahman","Nominated for 6 Oscars. Another 16 wins & 68 nominations.",8,"tt1535109"
"American Wedding",2003,"R","01 Aug 2003",96,"Comedy, Romance","Jesse Dylan","Adam Herz, Adam Herz","Jason Biggs, Seann William Scott, Alyson Hannigan, Eddie Kaye Thomas","3 wins & 6 nominations.",6.2,"tt0328828"
"Date Night",2010,"PG-13","09 Apr 2010",88,"Comedy, Crime, Romance","Shawn Levy","Josh Klausner","Steve Carell, Tina Fey, Mark Wahlberg, Taraji P. Henson","4 wins & 7 nominations.",6.3,"tt1279935"
"Maid in Manhattan",2002,"PG-13","13 Dec 2002",105,"Comedy, Drama, Romance","Wayne Wang","John Hughes","Jennifer Lopez, Ralph Fiennes, Natasha Richardson, Stanley Tucci","8 nominations.",4.9,"tt0252076"
"Flightplan",2005,"PG-13","23 Sep 2005",98,"Action, Drama, Mystery","Robert Schwentke","Peter A. Dowling, Billy Ray","Jodie Foster, Peter Sarsgaard, Sean Bean, Kate Beahan","1 win & 3 nominations.",6.2,"tt0408790"
"Shanghai Noon",2000,"PG-13","26 May 2000",110,"Action, Adventure, Comedy","Tom Dey","Miles Millar, Alfred Gough","Jackie Chan, Owen Wilson, Lucy Liu, Brandon Merrill","1 win & 7 nominations.",6.6,"tt0184894"
"Free Birds",2013,"PG","01 Nov 2013",91,"Animation, Adventure, Comedy","Jimmy Hayward","Scott Mosier","Owen Wilson, Woody Harrelson, Amy Poehler, George Takei","2 nominations.",5.8,"tt1621039"
"The Forbidden Kingdom",2008,"PG-13","18 Apr 2008",104,"Action, Adventure, Fantasy","Rob Minkoff","John Fusco","Jet Li, Michael Angarano, Jackie Chan, Juana Collignon","4 nominations.",6.6,"tt0865556"
"The Phantom of the Opera",2004,"PG-13","22 Dec 2004",143,"Drama, Musical, Romance","Joel Schumacher","Gaston Leroux","Gerard Butler, Emmy Rossum, Patrick Wilson, Miranda Richardson","Nominated for 3 Oscars. Another 6 wins & 27 nominations.",7.4,"tt0293508"
"Burlesque",2010,"PG-13","24 Nov 2010",119,"Drama, Musical, Romance","Steve Antin","Steve Antin","Cher, Christina Aguilera, Eric Dane, Cam Gigandet","Won 1 Golden Globe. Another 3 wins & 11 nominations.",6.3,"tt1126591"
"Changeling",2008,"R","31 Oct 2008",141,"Drama, History, Mystery","Clint Eastwood","J. Michael Straczynski","Angelina Jolie, Gattlin Griffith, Michelle Gunn, Michael Kelly","Nominated for 3 Oscars. Another 6 wins & 35 nominations.",7.8,"tt0824747"
"The Watch",2012,"R","27 Jul 2012",102,"Comedy, Sci-Fi","Akiva Schaffer","Jared Stern, Seth Rogen, Evan Goldberg","Ben Stiller, Vince Vaughn, Jonah Hill, Richard Ayoade","2 nominations.",5.7,"tt1298649"
"The Hunted",2003,"R","14 Mar 2003",94,"Action, Crime, Drama","William Friedkin","David Griffiths, Peter Griffiths, Art Monterastelli","Tommy Lee Jones, Benicio Del Toro, Connie Nielsen, Leslie Stefanson","2 nominations.",6,"tt0269347"
"Stuck on You",2003,"PG-13","12 Dec 2003",118,"Comedy","Bobby Farrelly, Peter Farrelly","Charles B. Wessler","Matt Damon, Greg Kinnear, Eva Mendes, Wen Yann Shih","1 nomination.",5.8,"tt0338466"
"The Pirates! Band of Misfits",2012,"PG","27 Apr 2012",88,"Animation, Adventure, Comedy","Peter Lord, Jeff Newitt","Gideon Defoe","Hugh Grant, Martin Freeman, Imelda Staunton, David Tennant","Nominated for 1 Oscar. Another 1 win & 12 nominations.",6.7,"tt1430626"
"Imagine That",2009,"PG","12 Jun 2009",107,"Comedy, Drama, Family","Karey Kirkpatrick","Ed Solomon, Chris Matheson","Eddie Murphy, Thomas Haden Church, Yara Shahidi, Ronny Cox","1 win & 2 nominations.",5.6,"tt0780567"
"Gods and Generals",2003,"PG-13","21 Feb 2003",219,"Drama, History, War","Ronald F. Maxwell","Jeff Shaara","Donzaleigh Abernathy, Mark Aldrich, George Allen, Keith Allison","1 win & 2 nominations.",6.3,"tt0279111"
"Bullet to the Head",2012,"R","01 Feb 2013",92,"Action, Crime, Thriller","Walter Hill","Alessandro Camon","Sylvester Stallone, Sung Kang, Sarah Shahi, Adewale Akinnuoye-Agbaje","1 nomination.",5.8,"tt1308729"
"All the King's Men",2006,"PG-13","22 Sep 2006",128,"Drama, Thriller","Steven Zaillian","Steven Zaillian","Sean Penn, Jude Law, Anthony Hopkins, Kate Winslet","1 win.",6.2,"tt0405676"
"A Very Long Engagement",2004,"R","27 Oct 2004",133,"Drama, Mystery, Romance","Jean-Pierre Jeunet","Sébastien Japrisot","Audrey Tautou, Gaspard Ulliel, Dominique Pinon, Chantal Neuwirth","Nominated for 2 Oscars. Another 19 wins & 24 nominations.",7.8,"tt0344510"
"Lucky You",2007,"PG-13","04 May 2007",124,"Drama, Romance, Sport","Curtis Hanson","Eric Roth","Phyllis Somerville, Eric Bana, Horatio Sanz, Drew Barrymore","1 nomination.",5.9,"tt0338216"
"You, Me and Dupree",2006,"PG-13","14 Jul 2006",108,"Comedy, Romance","Anthony Russo, Joe Russo","Michael LeSieur","Owen Wilson, Kate Hudson, Matt Dillon, Michael Douglas","1 win & 2 nominations.",5.6,"tt0463034"
"Seven Pounds",2008,"PG-13","19 Dec 2008",123,"Drama","Gabriele Muccino","Grant Nieporte","Will Smith, Rosario Dawson, Woody Harrelson, Michael Ealy","4 wins & 6 nominations.",7.6,"tt0814314"
"Elizabethtown",2005,"PG-13","14 Oct 2005",123,"Comedy, Drama, Romance","Cameron Crowe","Cameron Crowe","Orlando Bloom, Kirsten Dunst, Susan Sarandon, Alec Baldwin","1 win & 4 nominations.",6.4,"tt0368709"
"Gigli",2003,"R","01 Aug 2003",121,"Comedy, Crime, Romance","Martin Brest","Martin Brest","Ben Affleck, Terry Camilleri, David Backus, Lenny Venito","7 wins & 6 nominations.",2.3,"tt0299930"
"Shaft",2000,"R","16 Jun 2000",99,"Action, Crime, Thriller","John Singleton","Ernest Tidyman","Samuel L. Jackson, Vanessa Williams, Jeffrey Wright, Christian Bale","1 win & 13 nominations.",5.9,"tt0162650"
"The Dukes of Hazzard",2005,"PG-13","05 Aug 2005",104,"Action, Adventure, Comedy","Jay Chandrasekhar","John O'Brien","Johnny Knoxville, Seann William Scott, Alice Greczyn, Steve Lemme","2 wins & 9 nominations.",5,"tt0377818"
"Law Abiding Citizen",2009,"R","16 Oct 2009",109,"Crime, Drama, Thriller","F. Gary Gray","Kurt Wimmer","Jamie Foxx, Gerard Butler, Colm Meaney, Bruce McGill","2 wins & 5 nominations.",7.4,"tt1197624"
"Domestic Disturbance",2001,"PG-13","02 Nov 2001",89,"Crime, Mystery, Thriller","Harold Becker","Lewis Colick","John Travolta, James Lashly, Rebecca Tilney, Debra Mooney","1 win & 3 nominations.",5.5,"tt0249478"
"Flags of Our Fathers",2006,"R","20 Oct 2006",132,"Drama, History, War","Clint Eastwood","William Broyles Jr.","Ryan Phillippe, Jesse Bradford, Adam Beach, John Benjamin Hickey","Nominated for 2 Oscars. Another 15 wins & 15 nominations.",7.1,"tt0418689"
"Grindhouse",2007,"R","06 Apr 2007",191,"Action, Horror, Thriller","Robert Rodriguez, Eli Roth, Quentin Tarantino, Edgar Wright, Rob Zombie","Robert Rodriguez, Rob Zombie, Edgar Wright, Jeff Rendell, Eli Roth, Quentin Tarantino, Rob Cotterill","Kurt Russell, Zoë Bell, Rosario Dawson, Vanessa Ferlito","2 wins & 8 nominations.",7.7,"tt0462322"
"Zero Dark Thirty",2012,"R","11 Jan 2013",157,"Drama, History, Thriller","Kathryn Bigelow","Mark Boal","Jason Clarke, Reda Kateb, Jessica Chastain, Kyle Chandler","Won 1 Oscar. Another 57 wins & 72 nominations.",7.4,"tt1790885"
"Catch Me If You Can",2002,"PG-13","25 Dec 2002",141,"Biography, Crime, Drama","Steven Spielberg","Jeff Nathanson","Leonardo DiCaprio, Tom Hanks, Christopher Walken, Martin Sheen","Nominated for 2 Oscars. Another 12 wins & 19 nominations.",8,"tt0264464"
"Valentine's Day",2010,"PG-13","12 Feb 2010",125,"Comedy, Romance","Garry Marshall","Katherine Fugate","Jessica Alba, Kathy Bates, Jessica Biel, Bradley Cooper","6 wins & 11 nominations.",5.8,"tt0817230"
"The Change-Up",2011,"R","05 Aug 2011",112,"Comedy","David Dobkin","Jon Lucas, Scott Moore","Ryan Reynolds, Jason Bateman, Leslie Mann, Olivia Wilde","1 nomination.",6.4,"tt1488555"
"Bulletproof Monk",2003,"PG-13","16 Apr 2003",104,"Action, Comedy, Fantasy","Paul Hunter","Ethan Reiff, Cyrus Voris","Yun-Fat Chow, Seann William Scott, Jaime King, Karel Roden","1 nomination.",5.4,"tt0245803"
"Me, Myself & Irene",2000,"R","23 Jun 2000",116,"Comedy","Bobby Farrelly, Peter Farrelly","Peter Farrelly, Mike Cerrone, Bobby Farrelly","Jim Carrey, Renée Zellweger, Anthony Anderson, Mongo Brownlee","2 wins & 4 nominations.",6.5,"tt0183505"
"The Adjustment Bureau",2011,"PG-13","04 Mar 2011",106,"Fantasy, Romance, Thriller","George Nolfi","George Nolfi","Matt Damon, Emily Blunt, Michael Kelly, Anthony Mackie","1 win & 7 nominations.",7.1,"tt1385826"
"The Twilight Saga: New Moon",2009,"PG-13","20 Nov 2009",130,"Adventure, Drama, Fantasy","Chris Weitz","Melissa Rosenberg","Kristen Stewart, Christina Jastrzembska, Robert Pattinson, Billy Burke","16 wins & 19 nominations.",4.6,"tt1259571"
"Shrek",2001,"PG","18 May 2001",90,"Animation, Adventure, Comedy","Andrew Adamson, Vicky Jenson","William Steig","Mike Myers, Eddie Murphy, Cameron Diaz, John Lithgow","Won 1 Oscar. Another 30 wins & 46 nominations.",7.9,"tt0126029"
"Ted",2012,"R","29 Jun 2012",106,"Comedy, Fantasy","Seth MacFarlane","Seth MacFarlane","Mark Wahlberg, Mila Kunis, Seth MacFarlane, Joel McHale","Nominated for 1 Oscar. Another 6 wins & 21 nominations.",7.1,"tt1637725"
"Super 8",2011,"PG-13","10 Jun 2011",112,"Mystery, Sci-Fi, Thriller","J.J. Abrams","J.J. Abrams","Joel Courtney, Jessica Tuck, Joel McKinnon Miller, Ryan Lee","8 wins & 38 nominations.",7.1,"tt1650062"
"Mr. Deeds",2002,"PG-13","28 Jun 2002",96,"Comedy","Steven Brill","Clarence Budington Kelland","Adam Sandler, Winona Ryder, John Turturro, Allen Covert","4 wins & 7 nominations.",5.8,"tt0280590"
"Erin Brockovich",2000,"R","17 Mar 2000",131,"Biography, Drama","Steven Soderbergh","Susannah Grant","Julia Roberts, David Brisbin, Dawn Didawick, Albert Finney","Won 1 Oscar. Another 34 wins & 43 nominations.",7.3,"tt0195685"
"How to Lose a Guy in 10 Days",2003,"PG-13","07 Feb 2003",116,"Comedy, Romance","Donald Petrie","Michele Alexander","Kate Hudson, Matthew McConaughey, Kathryn Hahn, Annie Parisse","1 win & 7 nominations.",6.3,"tt0251127"
"Yes Man",2008,"PG-13","17 Dec 2008",104,"Comedy, Romance","Peyton Reed","Nicholas Stoller","Jim Carrey, Zooey Deschanel, Bradley Cooper, John Michael Higgins","3 wins & 7 nominations.",6.9,"tt1068680"
"Failure to Launch",2006,"PG-13","10 Mar 2006",97,"Comedy, Romance","Tom Dey","Tom J. Astle, Matt Ember","Matthew McConaughey, Sarah Jessica Parker, Zooey Deschanel, Justin Bartha","4 nominations.",5.6,"tt0427229"
"Inside Man",2006,"R","24 Mar 2006",129,"Crime, Drama, Thriller","Spike Lee","Russell Gewirtz","Denzel Washington, Clive Owen, Jodie Foster, Christopher Plummer","5 wins & 8 nominations.",7.7,"tt0454848"
"Knowing",2009,"PG-13","20 Mar 2009",121,"Action, Drama, Mystery","Alex Proyas","Ryne Douglas Pearson","Nicolas Cage, Chandler Canterbury, Rose Byrne, Lara Robinson","1 win & 3 nominations.",6.2,"tt0448011"
"The Ring Two",2005,"PG-13","18 Mar 2005",110,"Horror, Mystery, Thriller","Hideo Nakata","Ehren Kruger, Kôji Suzuki, Hiroshi Takahashi","Naomi Watts, Simon Baker, David Dorfman, Elizabeth Perkins","2 wins & 6 nominations.",5.3,"tt0377109"
"We Bought a Zoo",2011,"PG","23 Dec 2011",124,"Drama, Family","Cameron Crowe","Aline Brosh McKenna","Matt Damon, Scarlett Johansson, Thomas Haden Church, Colin Ford","1 win & 7 nominations.",7.2,"tt1389137"
"Moneyball",2011,"PG-13","23 Sep 2011",133,"Biography, Drama, Sport","Bennett Miller","Steven Zaillian","Brad Pitt, Jonah Hill, Philip Seymour Hoffman, Robin Wright","Nominated for 6 Oscars. Another 20 wins & 42 nominations.",7.6,"tt1210166"
"Christmas with the Kranks",2004,"PG","24 Nov 2004",99,"Comedy, Family","Joe Roth","John Grisham","Tim Allen, Jamie Lee Curtis, Dan Aykroyd, M. Emmet Walsh","2 wins & 1 nomination.",5.1,"tt0388419"
"V for Vendetta",2005,"R","17 Mar 2006",132,"Action, Sci-Fi, Thriller","James McTeigue","Andy Wachowski","Natalie Portman, Hugo Weaving, Stephen Rea, Stephen Fry","4 wins & 17 nominations.",8.2,"tt0434409"
"The Forgotten",2004,"PG-13","24 Sep 2004",91,"Drama, Mystery, Sci-Fi","Joseph Ruben","Gerald Di Pego","Julianne Moore, Christopher Kovaleski, Matthew Pleszewicz, Anthony Edwards","6 nominations.",5.8,"tt0356618"
"Shanghai Knights",2003,"PG-13","07 Feb 2003",114,"Action, Adventure, Comedy","David Dobkin","Alfred Gough, Alfred Gough, Miles Millar","Jackie Chan, Owen Wilson, Aaron Taylor-Johnson, Tom Fisher","4 nominations.",6.2,"tt0300471"
"Curious George",2006,"G","10 Feb 2006",86,"Animation, Adventure, Comedy","Matthew O'Callaghan","Ken Kaufman","Frank Welker, Will Ferrell, Shane Baumel, Timyra-Joi Beatty","1 nomination.",6.6,"tt0381971"
"American Reunion",2012,"R","06 Apr 2012",113,"Comedy","Jon Hurwitz, Hayden Schlossberg","Jon Hurwitz","Jason Biggs, Alyson Hannigan, Chris Klein, Thomas Ian Nicholas","1 win & 3 nominations.",6.8,"tt1605630"
"Hansel & Gretel: Witch Hunters",2013,"R","25 Jan 2013",88,"Action, Fantasy, Horror","Tommy Wirkola","Tommy Wirkola","Jeremy Renner, Gemma Arterton, Famke Janssen, Pihla Viitala","1 win & 3 nominations.",6.1,"tt1428538"
"I Am Number Four",2011,"PG-13","18 Feb 2011",109,"Drama, Romance, Sci-Fi","D.J. Caruso","Alfred Gough","Alex Pettyfer, Timothy Olyphant, Teresa Palmer, Dianna Agron","1 win & 1 nomination.",6.1,"tt1464540"
"Don't Say a Word",2001,"R","28 Sep 2001",113,"Crime, Thriller","Gary Fleder","Andrew Klavan","Michael Douglas, Sean Bean, Brittany Murphy, Skye McCole Bartusiak","1 nomination.",6.3,"tt0260866"
"Unfaithful",2002,"R","10 May 2002",124,"Drama, Romance, Thriller","Adrian Lyne","Claude Chabrol","Diane Lane, Erik Per Sullivan, Richard Gere, Olivier Martinez","Nominated for 1 Oscar. Another 5 wins & 7 nominations.",6.7,"tt0250797"
"Syriana",2005,"R","09 Dec 2005",128,"Drama, Thriller","Stephen Gaghan","Stephen Gaghan, Robert Baer","Kayvan Novak, George Clooney, Amr Waked, Christopher Plummer","Won 1 Oscar. Another 9 wins & 21 nominations.",7,"tt0365737"
"Resident Evil: Apocalypse",2004,"R","10 Sep 2004",94,"Action, Horror, Sci-Fi","Alexander Witt","Paul W.S. Anderson","Milla Jovovich, Sienna Guillory, Oded Fehr, Thomas Kretschmann","2 wins & 3 nominations.",6.1,"tt0318627"
"Silent Hill",2006,"R","21 Apr 2006",125,"Horror, Mystery","Christophe Gans","Roger Avary","Radha Mitchell, Sean Bean, Laurie Holden, Deborah Kara Unger","8 nominations.",6.6,"tt0384537"
"Out of Time",2003,"R","03 Oct 2003",105,"Crime, Drama, Thriller","Carl Franklin","David Collard","Denzel Washington, Eva Mendes, Sanaa Lathan, Dean Cain","4 wins & 7 nominations.",6.5,"tt0313443"
"Bridget Jones: The Edge of Reason",2004,"R","19 Nov 2004",108,"Comedy, Romance","Beeban Kidron","Helen Fielding","Renée Zellweger, Gemma Jones, Jim Broadbent, James Faulkner","Nominated for 1 Golden Globe. Another 6 nominations.",5.8,"tt0317198"
"The Beach",2000,"R","11 Feb 2000",119,"Adventure, Drama, Romance","Danny Boyle","John Hodge","Leonardo DiCaprio, Daniel York, Patcharawan Patarakijjanon, Virginie Ledoyen","7 nominations.",6.6,"tt0163978"
