"Title","Year","Rated","Released","Runtime","Genre","Director","Writer","Actors","Awards","imdbRating","imdbID"
"Crossroads",2002,"PG-13","15 Feb 2002",93,"Adventure, Comedy, Drama","Tamra Davis","Shonda Rhimes","Britney Spears, Anson Mount, Zoe Saldana, Taryn Manning","2 wins & 11 nominations.",3.2,"tt0275022"
"Quarantine",2008,"R","10 Oct 2008",89,"Horror, Thriller","John Erick Dowdle","John Erick Dowdle","Jennifer Carpenter, Steve Harris, Jay Hernandez, Johnathon Schaech","1 win & 3 nominations.",6.1,"tt1082868"
"One Hour Photo",2002,"R","13 Sep 2002",96,"Drama, Thriller","Mark Romanek","Mark Romanek","Robin Williams, Connie Nielsen, Michael Vartan, Dylan Smith","7 wins & 15 nominations.",6.8,"tt0265459"
"The Eye",2008,"PG-13","01 Feb 2008",98,"Drama, Horror, Thriller","David Moreau, Xavier Palud","Sebastian Gutierrez, Yuet-Jan Hui, Oxide Pang Chun, Danny Pang","Jessica Alba, Alessandro Nivola, Parker Posey, Rade Serbedzija","2 wins & 2 nominations.",5.4,"tt0406759"
"Johnson Family Vacation",2004,"PG-13","07 Apr 2004",97,"Comedy","Christopher Erskin","Todd R. Jones, Earl Richey Jones","Cedric the Entertainer, Vanessa Williams, Solange Knowles, Bow Wow","3 nominations.",4.1,"tt0359517"
"Crank",2006,"R","01 Sep 2006",88,"Action, Crime, Thriller","Mark Neveldine, Brian Taylor","Mark Neveldine, Brian Taylor","Jason Statham, Amy Smart, Jose Pablo Cantillo, Efren Ramirez","1 win.",7,"tt0479884"
"Frida",2002,"R","20 Nov 2002",123,"Biography, Drama, Romance","Julie Taymor","Hayden Herrera","Salma Hayek, Alfred Molina, Antonio Banderas, Valeria Golino","Won 2 Oscars. Another 17 wins & 30 nominations.",7.4,"tt0120679"
"Faster",2010,"R","24 Nov 2010",98,"Action, Crime, Drama","George Tillman Jr.","Tony Gayton, Joe Gayton","Dwayne Johnson, Mauricio Lopez, Jim Gaines, Tom Berenger","5 nominations.",6.5,"tt1433108"
"Casino Royale",2006,"PG-13","17 Nov 2006",144,"Action, Crime, Thriller","Martin Campbell","Neal Purvis","Daniel Craig, Eva Green, Mads Mikkelsen, Judi Dench","Won 1 BAFTA Film Award. Another 17 wins & 29 nominations.",8,"tt0381061"
"The Upside of Anger",2005,"R","01 Apr 2005",118,"Comedy, Drama","Mike Binder","Mike Binder","Joan Allen, Kevin Costner, Erika Christensen, Keri Russell","4 wins & 8 nominations.",6.9,"tt0365885"
"Aquamarine",2006,"PG","03 Mar 2006",104,"Comedy, Family, Fantasy","Elizabeth Allen Rosenbaum","John Quaintance","Emma Roberts, Joanna 'JoJo' Levesque, Sara Paxton, Jake McDorman","1 win & 5 nominations.",5.2,"tt0429591"
"Nebraska",2013,"R","24 Jan 2014",115,"Adventure, Drama","Alexander Payne","Bob Nelson","Bruce Dern, Will Forte, June Squibb, Bob Odenkirk","Nominated for 6 Oscars. Another 27 wins & 61 nominations.",7.9,"tt1821549"
"Max Keeble's Big Move",2001,"PG","05 Oct 2001",86,"Comedy, Crime, Family","Tim Hill","David L. Watts","Alex D. Linz, Larry Miller, Jamie Kennedy, Zena Grey","1 win & 1 nomination.",5.3,"tt0273799"
"Young Adult",2011,"R","16 Dec 2011",94,"Comedy, Drama","Jason Reitman","Diablo Cody","Charlize Theron, Patton Oswalt, Patrick Wilson, Elizabeth Reaser","Nominated for 1 Golden Globe. Another 6 wins & 11 nominations.",6.3,"tt1625346"
"About Time",2013,"R","08 Nov 2013",123,"Drama, Fantasy, Romance","Richard Curtis","Richard Curtis","Domhnall Gleeson, Rachel McAdams, Bill Nighy, Lydia Wilson","1 win & 6 nominations.",7.8,"tt2194499"
"Rachel Getting Married",2008,"R","31 Oct 2008",113,"Drama, Romance","Jonathan Demme","Jenny Lumet","Sebastian Stan, Roslyn Ruff, Anne Hathaway, Bill Irwin","Nominated for 1 Oscar. Another 26 wins & 22 nominations.",6.7,"tt1084950"
"Girl with a Pearl Earring",2003,"PG-13","09 Jan 2004",100,"Biography, Drama, Romance","Peter Webber","Tracy Chevalier","Colin Firth, Scarlett Johansson, Tom Wilkinson, Judy Parfitt","Nominated for 3 Oscars. Another 14 wins & 35 nominations.",7,"tt0335119"
"House of Flying Daggers",2004,"PG-13","14 Jan 2005",119,"Action, Adventure, Drama","Yimou Zhang","Feng Li, Bin Wang, Yimou Zhang","Takeshi Kaneshiro, Andy Lau, Ziyi Zhang, Dandan Song","Nominated for 1 Oscar. Another 21 wins & 39 nominations.",7.6,"tt0385004"
"Sorority Boys",2002,"R","22 Mar 2002",93,"Comedy","Wallace Wolodarsky","Joe Jarvis, Greg Coolidge","Barry Watson, Michael Rosenbaum, Harland Williams, Melissa Sagemiller","1 win & 1 nomination.",5.4,"tt0279781"
"Cadillac Records",2008,"R","05 Dec 2008",109,"Biography, Drama, History","Darnell Martin","Darnell Martin","Joshua Alscher, Tim Bellow, Tony Bentley, Tammy Blanchard","Nominated for 1 Golden Globe. Another 4 wins & 17 nominations.",6.9,"tt1042877"
"The Alamo",2004,"PG-13","09 Apr 2004",137,"Drama, History, War","John Lee Hancock","Leslie Bohem, Stephen Gaghan, John Lee Hancock","Dennis Quaid, Billy Bob Thornton, Jason Patric, Patrick Wilson","1 nomination.",6,"tt0318974"
"Running with Scissors",2006,"R","27 Oct 2006",116,"Comedy, Drama","Ryan Murphy","Ryan Murphy","Annette Bening, Brian Cox, Joseph Fiennes, Evan Rachel Wood","Nominated for 1 Golden Globe. Another 2 wins & 3 nominations.",6.2,"tt0439289"
"For Your Consideration",2006,"PG-13","22 Nov 2006",86,"Comedy","Christopher Guest","Christopher Guest, Eugene Levy","Catherine O'Hara, Stephen Rannazzisi, Ed Begley Jr., Eugene Levy","3 wins & 6 nominations.",6.3,"tt0470765"
"From Justin to Kelly",2003,"PG","20 Jun 2003",81,"Comedy, Musical, Romance","Robert Iscove","Kim Fuller","Kelly Clarkson, Justin Guarini, Katherine Bailess, Anika Noni Rose","2 wins & 11 nominations.",2.1,"tt0339034"
"In the Cut",2003,"R","31 Oct 2003",119,"Mystery, Thriller","Jane Campion","Jane Campion","Jennifer Jason Leigh, Meg Ryan, Michael Nuccio, Allison Nega","1 win & 2 nominations.",5.3,"tt0199626"
"Charlie Bartlett",2007,"R","22 Feb 2008",97,"Comedy, Drama, Romance","Jon Poll","Gustin Nash","Anton Yelchin, Robert Downey Jr., Hope Davis, Kat Dennings","1 win.",7,"tt0423977"
"Two Lovers",2008,"R","19 Nov 2008",110,"Drama, Romance","James Gray","James Gray, Ric Menello","Joaquin Phoenix, Anne Joyce, Elliot Villar, Craig Walker","2 wins & 7 nominations.",7.1,"tt1103275"
"Last Orders",2001,"R","11 Jan 2002",109,"Drama","Fred Schepisi","Graham Swift, Fred Schepisi","Michael Caine, Tom Courtenay, David Hemmings, Bob Hoskins","3 wins & 4 nominations.",7,"tt0253200"
"The Dangerous Lives of Altar Boys",2002,"R","17 May 2002",104,"Comedy, Drama","Peter Care","Chris Fuhrman","Emile Hirsch, Kieran Culkin, Vincent D'Onofrio, Jena Malone","2 wins.",7.1,"tt0238924"
"2046",2004,"R","29 Sep 2004",129,"Drama, Fantasy, Romance","Kar Wai Wong","Kar Wai Wong","Tony Chiu Wai Leung, Li Gong, Faye Wong, Takuya Kimura","32 wins & 31 nominations.",7.5,"tt0212712"
"Duma",2005,"PG","27 May 2005",100,"Adventure, Drama, Family","Carroll Ballard","Carol Cawthra Hopcraft","Alex Michaeletos, Campbell Scott, Mary Makhatho, Nthabiseng Kenoshi","1 win.",7.3,"tt0361715"
"Ondine",2009,"PG-13","05 Mar 2010",111,"Drama, Romance","Neil Jordan","Neil Jordan","Colin Farrell, Alicja Bachleda, Dervla Kirwan, Alison Barry","6 wins & 6 nominations.",6.8,"tt1235796"
"Brother",2000,"R","27 Jan 2001",114,"Crime, Drama, Thriller","Takeshi Kitano","Takeshi Kitano","Takeshi Kitano, Omar Epps, Claude Maki, Masaya Katô","1 win & 1 nomination.",7.3,"tt0222851"
"Welcome to Collinwood",2002,"R","18 Oct 2002",86,"Comedy, Crime","Anthony Russo, Joe Russo","Anthony Russo","William H. Macy, Isaiah Washington, Sam Rockwell, Michael Jeter","1 nomination.",6.4,"tt0271259"
"The Life Before Her Eyes",2007,"R","05 Sep 2008",90,"Drama, Mystery, Thriller","Vadim Perelman","Laura Kasischke","Uma Thurman, Evan Rachel Wood, Eva Amurri Martino, Gabrielle Brennan","1 win.",6.5,"tt0815178"
"Trade",2007,"R","18 Oct 2007",120,"Crime, Drama, Thriller","Marco Kreuzpaintner","Jose Rivera","Kevin Kline, Cesar Ramos, Alicja Bachleda, Paulina Gaitan","5 wins & 2 nominations.",7.5,"tt0399095"
"Fateless",2005,"R","10 Feb 2005",140,"Drama, War","Lajos Koltai","Imre Kertész","Marcell Nagy, Béla Dóra, Bálint Péntek, Áron Dimény","5 wins & 4 nominations.",7.2,"tt0367082"
"Triangle",2009,"R","16 Oct 2009",99,"Mystery, Thriller","Christopher Smith","Christopher Smith","Melissa George, Joshua McIvor, Jack Taylor, Michael Dorman","1 win & 3 nominations.",6.9,"tt1187064"
"St. Trinian's",2007,"PG-13","21 Dec 2007",97,"Comedy","Oliver Parker, Barnaby Thompson","Piers Ashworth","Talulah Riley, Rupert Everett, Jodie Whittaker, Gemma Arterton","5 nominations.",5.8,"tt0964587"
"The Fighter",2010,"R","17 Dec 2010",116,"Biography, Drama, Sport","David O. Russell","Scott Silver","Mark Wahlberg, Christian Bale, Amy Adams, Melissa Leo","Won 2 Oscars. Another 42 wins & 55 nominations.",7.9,"tt0964517"
"High School Musical 3: Senior Year",2008,"G","24 Oct 2008",112,"Comedy, Drama, Family","Kenny Ortega","Peter Barsocchini, Peter Barsocchini","Zac Efron, Vanessa Hudgens, Ashley Tisdale, Lucas Grabeel","8 wins & 9 nominations.",4.2,"tt0962726"
"Phone Booth",2002,"R","04 Apr 2003",81,"Mystery, Thriller","Joel Schumacher","Larry Cohen","Colin Farrell, Kiefer Sutherland, Forest Whitaker, Radha Mitchell","7 nominations.",7.1,"tt0183649"
"A Walk to Remember",2002,"PG","25 Jan 2002",101,"Drama, Romance","Adam Shankman","Nicholas Sparks","Shane West, Mandy Moore, Peter Coyote, Daryl Hannah","4 wins & 2 nominations.",7.4,"tt0281358"
"The Secret Life of Bees",2008,"PG-13","17 Oct 2008",114,"Drama","Gina Prince-Bythewood","Gina Prince-Bythewood","Dakota Fanning, Queen Latifah, Jennifer Hudson, Alicia Keys","10 wins & 16 nominations.",7.3,"tt0416212"
"Corky Romano",2001,"PG-13","12 Oct 2001",86,"Comedy, Crime","Rob Pritts","David Garrett, Jason Ward","Chris Kattan, Vinessa Shaw, Peter Falk, Peter Berg","1 nomination.",4.6,"tt0250310"
"The Ladies Man",2000,"R","13 Oct 2000",84,"Comedy","Reginald Hudlin","Tim Meadows, Dennis McNicholas, Andrew Steele","Tim Meadows, Karyn Parsons, Billy Dee Williams, John Witherspoon","1 nomination.",5.1,"tt0213790"
"Frailty",2001,"R","12 Apr 2002",100,"Crime, Drama, Thriller","Bill Paxton","Brent Hanley","Bill Paxton, Matthew McConaughey, Powers Boothe, Matt O'Leary","6 wins & 8 nominations.",7.3,"tt0264616"
"Kinsey",2004,"R","24 Mar 2005",118,"Biography, Drama","Bill Condon","Bill Condon","Liam Neeson, Laura Linney, Chris O'Donnell, Peter Sarsgaard","Nominated for 1 Oscar. Another 17 wins & 33 nominations.",7.1,"tt0362269"
"Vera Drake",2004,"R","07 Jan 2005",125,"Crime, Drama","Mike Leigh","Mike Leigh","Imelda Staunton, Richard Graham, Eddie Marsan, Anna Keaveney","Nominated for 3 Oscars. Another 36 wins & 28 nominations.",7.7,"tt0383694"
"The Guru",2002,"R","14 Feb 2003",94,"Comedy, Fantasy, Music","Daisy von Scherler Mayer","Tracey Jackson","Jimi Mistry, Heather Graham, Marisa Tomei, Michael McKean","1 nomination.",5.5,"tt0280720"
"Copying Beethoven",2006,"PG-13","08 Mar 2007",104,"Biography, Drama, Music","Agnieszka Holland","Stephen J. Rivele, Christopher Wilkinson","Diane Kruger, Ralph Riach, Matyelok Gibbs, Ed Harris","2 wins & 5 nominations.",6.8,"tt0424908"
"Brighton Rock",2010,"R","04 Feb 2011",111,"Crime, Drama, Thriller","Rowan Joffe","Rowan Joffe, Graham Greene","Sam Riley, Andrea Riseborough, Helen Mirren, John Hurt","6 nominations.",5.8,"tt1233192"
"LOL",2012,"PG-13","01 Mar 2012",97,"Comedy, Drama, Romance","Lisa Azuelos","Lisa Azuelos","Jean-Luc Bilodeau, Douglas Booth, Vivian Le Borgne, Bridget Brown","1 nomination.",4.1,"tt1592873"
"Saw V",2008,"R","24 Oct 2008",92,"Crime, Horror, Thriller","David Hackl","Patrick Melton","Tobin Bell, Costas Mandylor, Scott Gordon-Patterson, Betsy Russell","1 nomination.",5.8,"tt1132626"
"Jindabyne",2006,"R","20 Jul 2006",123,"Crime, Drama, Mystery","Ray Lawrence","Raymond Carver, Beatrix Christian","Chris Haywood, Tatea Reilly, Laura Linney, Sean Rees-Wemyss","11 wins & 20 nominations.",6.4,"tt0382765"
"Kabhi Alvida Naa Kehna",2006,"R","11 Aug 2006",193,"Drama","Karan Johar","Karan Johar","Shah Rukh Khan, Rani Mukerji, Amitabh Bachchan, Preity Zinta","4 wins & 22 nominations.",6,"tt0449999"
"Darkness",2002,"PG-13","25 Dec 2004",102,"Horror","Jaume Balagueró","Jaume Balagueró, Fernando de Felipe, Miguel Tejada-Flores","Anna Paquin, Lena Olin, Iain Glen, Giancarlo Giannini","2 wins & 3 nominations.",5.4,"tt0273517"
"The Blue Butterfly",2004,"PG","26 Aug 2004",97,"Drama, Adventure","Léa Pool","Pete McCormack","William Hurt, Pascale Bussières, Marc Donato, Raoul Trujillo","1 win & 6 nominations.",6.3,"tt0313300"
"September Dawn",2007,"R","24 Aug 2007",111,"Drama, History, Western","Christopher Cain","Christopher Cain, Carole Whang Schutter","Terence Stamp, Trent Ford, Krisinda Cain, Shaun Johnston","2 nominations.",5.8,"tt0473700"
"The Grudge",2004,"PG-13","22 Oct 2004",92,"Horror, Mystery, Thriller","Takashi Shimizu","Stephen Susco","Sarah Michelle Gellar, Jason Behr, William Mapother, Clea DuVall","3 wins & 7 nominations.",5.8,"tt0391198"
"Saw III",2006,"R","27 Oct 2006",108,"Crime, Horror, Thriller","Darren Lynn Bousman","Leigh Whannell","Tobin Bell, Shawnee Smith, Angus Macfadyen, Bahar Soomekh","4 nominations.",6.2,"tt0489270"
"Bring It On",2000,"PG-13","25 Aug 2000",98,"Comedy, Sport","Peyton Reed","Jessica Bendinger","Kirsten Dunst, Eliza Dushku, Jesse Bradford, Gabrielle Union","2 wins & 7 nominations.",5.9,"tt0204946"
"Saw IV",2007,"R","26 Oct 2007",93,"Crime, Horror, Thriller","Darren Lynn Bousman","Patrick Melton","Tobin Bell, Costas Mandylor, Scott Gordon-Patterson, Betsy Russell","1 win & 6 nominations.",5.9,"tt0890870"
"Madea's Family Reunion",2006,"PG-13","24 Feb 2006",107,"Comedy, Drama, Romance","Tyler Perry","Tyler Perry","Tyler Perry, Blair Underwood, Lynn Whitfield, Boris Kodjoe","7 nominations.",4.8,"tt0455612"
"White Noise",2005,"PG-13","07 Jan 2005",101,"Drama, Horror, Mystery","Geoffrey Sax","Niall Johnson","Michael Keaton, Chandra West, Deborah Kara Unger, Ian McNeice","1 win & 2 nominations.",5.5,"tt0375210"
"The Best Exotic Marigold Hotel",2011,"PG-13","25 May 2012",124,"Comedy, Drama","John Madden","Ol Parker","Judi Dench, Tom Wilkinson, Patrick Pearson, Hugh Dickson","Nominated for 2 Golden Globes. Another 16 nominations.",7.3,"tt1412386"
"Jeepers Creepers",2001,"R","31 Aug 2001",90,"Horror, Mystery","Victor Salva","Victor Salva","Gina Philips, Justin Long, Jonathan Breck, Patricia Belcher","1 win & 4 nominations.",6,"tt0263488"
"Nick and Norah's Infinite Playlist",2008,"PG-13","03 Oct 2008",90,"Comedy, Drama, Music","Peter Sollett","Lorene Scafaria","Michael Cera, Kat Dennings, Aaron Yoo, Rafi Gavron","9 nominations.",6.7,"tt0981227"
"The Banger Sisters",2002,"R","20 Sep 2002",98,"Comedy, Drama","Bob Dolman","Bob Dolman","Goldie Hawn, Susan Sarandon, Geoffrey Rush, Erika Christensen","Nominated for 1 Golden Globe. Another 1 win.",5.6,"tt0280460"
"Employee of the Month",2006,"PG-13","06 Oct 2006",103,"Comedy, Romance","Greg Coolidge","Don Calame","Dane Cook, Jessica Simpson, Dax Shepard, Andy Dick","2 nominations.",5.5,"tt0424993"
"Sparkle",2012,"PG-13","17 Aug 2012",116,"Drama, Music","Salim Akil","Mara Brock Akil","Jordin Sparks, Whitney Houston, Derek Luke, Mike Epps","7 nominations.",5.6,"tt1876451"
"Valentine",2001,"R","02 Feb 2001",96,"Horror, Thriller","Jamie Blanks","Tom Savage","Denise Richards, David Boreanaz, Marley Shelton, Jessica Capshaw","1 win.",4.6,"tt0242998"
"Reno 911!: Miami",2007,"R","23 Feb 2007",84,"Comedy, Crime","Robert Ben Garant","Robert Ben Garant, Thomas Lennon, Kerri Kenney, Robert Ben Garant","Lennie Loftin, Danny DeVito, Robert Ben Garant, Niecy Nash","1 nomination.",5.9,"tt0499554"
"Kit Kittredge: An American Girl",2008,"G","02 Jul 2008",101,"Drama, Family","Patricia Rozema","Ann Peacock, Valerie Tripp","Abigail Breslin, Julia Ormond, Chris O'Donnell, Jane Krakowski","1 win & 5 nominations.",6.7,"tt0846308"
"Roll Bounce",2005,"PG-13","23 Sep 2005",112,"Comedy, Drama, Music","Malcolm D. Lee","Norman Vance Jr.","Bow Wow, Chi McBride, Meagan Good, Wesley Jonathan","2 wins & 6 nominations.",5.9,"tt0403455"
"The Perfect Man",2005,"PG","17 Jun 2005",100,"Comedy, Family, Romance","Mark Rosman","Michael McQuown","Hilary Duff, Heather Locklear, Chris Noth, Mike O'Malley","2 wins & 3 nominations.",5.4,"tt0380623"
"Wrong Turn",2003,"R","30 May 2003",84,"Horror, Thriller","Rob Schmidt","Alan B. McElroy","Desmond Harrington, Eliza Dushku, Emmanuelle Chriqui, Jeremy Sisto","3 nominations.",6.1,"tt0295700"
"Hey Arnold! The Movie",2002,"PG","28 Jun 2002",76,"Animation, Adventure, Comedy","Tuck Tucker","Craig Bartlett, Craig Bartlett, Steve Viksten","Spencer Klein, Francesca Smith, Jamil Walker Smith, Dan Castellaneta","1 nomination.",5.8,"tt0314166"
"The Matador",2005,"R","27 Jan 2006",96,"Comedy, Crime, Drama","Richard Shepard","Richard Shepard","Pierce Brosnan, Arlin Miller, Azucena Medina, Jonah Meyerson","Nominated for 1 Golden Globe. Another 1 win & 2 nominations.",6.9,"tt0365485"
"The Gift",2000,"R","19 Jan 2001",111,"Crime, Drama, Fantasy","Sam Raimi","Billy Bob Thornton, Tom Epperson","Cate Blanchett, Giovanni Ribisi, Keanu Reeves, Katie Holmes","8 nominations.",6.7,"tt0219699"
"End of the Spear",2005,"PG-13","20 Jan 2006",108,"Adventure, Drama","Jim Hanon","Bill Ewing, Bart Gavigan, Jim Hanon","Louie Leonardo, Chad Allen, Jack Guzman, Christina Souza","1 win & 1 nomination.",7,"tt0399862"
"Get Over It",2001,"PG-13","09 Mar 2001",87,"Comedy, Romance","Tommy O'Haver","R. Lee Fleming Jr.","Kirsten Dunst, Ben Foster, Melissa Sagemiller, Sisqó","1 nomination.",5.8,"tt0192071"
"Sleepover",2004,"PG","09 Jul 2004",89,"Comedy","Joe Nussbaum","Elisa Bell","Alexa PenaVega, Mika Boorem, Jane Lynch, Sam Huntington","1 win & 3 nominations.",5.2,"tt0368975"
"Movie 43",2013,"R","25 Jan 2013",94,"Comedy","Elizabeth Banks, Steven Brill, Steve Carr, Rusty Cundieff, James Duffy, Griffin Dunne, Peter Farrelly, Patrik Forsberg, Will Graham, James Gunn, Brett Ratner, Jonathan van Tulleken, Bob Odenkirk","Rocky Russo, Jeremy Sosenko, Ricky Blitt, Rocky Russo, Will Carlough, Jonathan van Tulleken, Elizabeth Shapiro, Patrik Forsberg, Olle Sarri, Jacob Fleisher, Greg Pritikin, Rocky Russo, Jeremy Sosenko, James Gunn","Dennis Quaid, Greg Kinnear, Common, Charlie Saxton","3 wins & 4 nominations.",4.4,"tt1333125"
"Dirty Pretty Things",2002,"R","13 Dec 2002",97,"Crime, Drama, Thriller","Stephen Frears","Steven Knight","Audrey Tautou, Chiwetel Ejiofor, Sergi López, Sophie Okonedo","Nominated for 1 Oscar. Another 18 wins & 20 nominations.",7.4,"tt0301199"
"Turistas",2006,"R","01 Dec 2006",93,"Horror, Mystery, Thriller","John Stockwell","Michael Ross","Josh Duhamel, Melissa George, Olivia Wilde, Desmond Askew","1 nomination.",5.3,"tt0454970"
"Deuces Wild",2002,"R","03 May 2002",96,"Action, Crime, Drama","Scott Kalvert","Paul Kimatian, Christopher Gambale","Stephen Dorff, Brad Renfro, Fairuza Balk, Norman Reedus","1 nomination.",5.6,"tt0231448"
"Run, Fatboy, Run",2007,"PG-13","28 Mar 2008",100,"Comedy, Romance, Sport","David Schwimmer","Michael Ian Black","Simon Pegg, Thandie Newton, Hank Azaria, Dylan Moran","3 nominations.",6.7,"tt0425413"
"Rescue Dawn",2006,"PG-13","27 Jul 2007",126,"Adventure, Biography, Drama","Werner Herzog","Werner Herzog","Zach Grenier, Marshall Bell, Christian Bale, Toby Huss","1 win & 4 nominations.",7.4,"tt0462504"
"I Am Love",2009,"R","19 Mar 2010",120,"Drama, Romance","Luca Guadagnino","Barbara Alberti","Tilda Swinton, Flavio Parenti, Edoardo Gabbriellini, Alba Rohrwacher","Nominated for 1 Oscar. Another 8 wins & 20 nominations.",7,"tt1226236"
"On the Line",2001,"PG","26 Oct 2001",85,"Comedy, Family, Romance","Eric Bross","Eric Aronson, Paul B. Stanton","Lance Bass, Joey Fatone, Emmanuelle Chriqui, GQ","2 nominations.",4,"tt0279286"
"Crash",2004,"R","06 May 2005",112,"Drama","Paul Haggis","Paul Haggis","Karina Arroyave, Dato Bakhtadze, Sandra Bullock, Don Cheadle","Won 3 Oscars. Another 52 wins & 74 nominations.",7.9,"tt0375679"
"The House of Mirth",2000,"PG","07 Mar 2001",140,"Romance, Drama","Terence Davies","Edith Wharton, Terence Davies","Gillian Anderson, Dan Aykroyd, Eleanor Bron, Terry Kinney","11 wins & 15 nominations.",7.1,"tt0200720"
"Bamboozled",2000,"R","23 Feb 2001",135,"Comedy, Drama, Music","Spike Lee","Spike Lee","Damon Wayans, Savion Glover, Jada Pinkett Smith, Tommy Davidson","1 win & 9 nominations.",6.4,"tt0215545"
"The Iceman",2012,"R","02 May 2013",106,"Biography, Crime, Drama","Ariel Vromen","Morgan Land","Michael Shannon, Winona Ryder, Chris Evans, Ray Liotta","2 wins.",6.9,"tt1491044"
"A Better Life",2011,"PG-13","28 Jul 2011",98,"Drama","Chris Weitz","Eric Eason","Demian Bichir, Eddie 'Piolin' Sotelo, Joaquín Cosio, José Julián","Nominated for 1 Oscar. Another 5 wins & 6 nominations.",7.2,"tt1554091"
"Spider",2002,"R","13 Dec 2002",98,"Drama","David Cronenberg","Patrick McGrath, Patrick McGrath","Ralph Fiennes, Miranda Richardson, Gabriel Byrne, Lynn Redgrave","12 wins & 22 nominations.",6.9,"tt0278731"
"Nicholas Nickleby",2002,"PG","27 Jun 2003",132,"Drama, Romance","Douglas McGrath","Charles Dickens","Stella Gonet, Andrew Havill, Henry McGrath, Hugh Mitchell","Nominated for 1 Golden Globe. Another 1 win & 3 nominations.",7.3,"tt0309912"
"Krrish",2006,"Not Rated","23 Jun 2006",154,"Action, Adventure, Romance","Rakesh Roshan","Robin Bhatt","Rekha, Hrithik Roshan, Priyanka Chopra, Sharat Saxena","8 wins & 12 nominations.",6.3,"tt0432637"
"Cecil B. DeMented",2000,"R","02 Aug 2000",87,"Comedy, Crime, Thriller","John Waters","John Waters","Melanie Griffith, Stephen Dorff, Alicia Witt, Adrian Grenier","1 nomination.",6.2,"tt0173716"
"Owning Mahowny",2003,"R","25 Sep 2003",104,"Crime, Thriller, Drama","Richard Kwietniowski","Gary Stephen Ross","Philip Seymour Hoffman, Minnie Driver, John Hurt, Maury Chaykin","3 wins & 5 nominations.",7.1,"tt0285861"
"Coriolanus",2011,"R","20 Jan 2012",123,"Drama, Thriller, War","Ralph Fiennes","John Logan","Ralph Fiennes, Gerard Butler, Lubna Azabal, Ashraf Barhom","Nominated for 1 BAFTA Film Award. Another 10 wins & 8 nominations.",6.1,"tt1372686"
"Swept Away",2002,"R","11 Oct 2002",89,"Comedy, Romance","Guy Ritchie","Guy Ritchie","Bruce Greenwood, Madonna, Elizabeth Banks, Michael Beattie","5 wins & 5 nominations.",3.6,"tt0291502"
"War, Inc.",2008,"R","04 Sep 2008",107,"Action, Comedy, Thriller","Joshua Seftel","Mark Leyner, Jeremy Pikser, John Cusack","John Cusack, Hilary Duff, Marisa Tomei, Joan Cusack","1 nomination.",5.7,"tt0884224"
"Shaolin Soccer",2001,"PG","12 Jul 2001",87,"Action, Comedy, Sport","Stephen Chow","Stephen Chow, Kan-Cheung Tsang, Min Hun Fung, Chi Keung Fung, Wei Lu","Stephen Chow, Wei Zhao, Man Tat Ng, Yin Tse","13 wins & 7 nominations.",7.3,"tt0286112"
"The Brown Bunny",2003,"Not Rated","07 Apr 2004",93,"Drama","Vincent Gallo","Vincent Gallo","Vincent Gallo, Chloë Sevigny, Cheryl Tiegs, Elizabeth Blake","1 win & 2 nominations.",5,"tt0330099"
"Imaginary Heroes",2004,"R","10 Nov 2005",111,"Comedy, Drama","Dan Harris","Dan Harris","Sigourney Weaver, Emile Hirsch, Jeff Daniels, Michelle Williams","1 win & 2 nominations.",7.3,"tt0373024"
"High Heels and Low Lifes",2001,"R","20 Jul 2001",86,"Action, Drama, Comedy","Mel Smith","Kim Fuller","Minnie Driver, Mary McCormack, Kevin McNally, Mark Williams","1 nomination.",6.2,"tt0253126"
"Welcome to the Rileys",2010,"R","18 Nov 2011",110,"Drama","Jake Scott","Ken Hixon","James Gandolfini, Kristen Stewart, Melissa Leo, Joe Chrest","1 win & 2 nominations.",7,"tt1183923"
"Severance",2006,"R","25 Aug 2006",96,"Comedy, Horror, Thriller","Christopher Smith","James Moran","Toby Stephens, Claudie Blakley, Andy Nyman, Babou Ceesay","3 wins & 2 nominations.",6.6,"tt0464196"
"Edmond",2005,"R","24 Nov 2006",82,"Drama, Thriller","Stuart Gordon","David Mamet","William H. Macy, Frances Bay, Rebecca Pidgeon, Joe Mantegna","3 wins & 2 nominations.",6.3,"tt0443496"
"Motherhood",2009,"PG-13","28 Aug 2009",90,"Comedy, Drama","Katherine Dieckmann","Katherine Dieckmann","Uma Thurman, Anthony Edwards, David Schallipp, Matthew Schallipp","1 win.",4.7,"tt1220220"
"The Oxford Murders",2008,"R","02 Jul 2010",104,"Crime, Mystery, Thriller","Álex de la Iglesia","Álex de la Iglesia","Elijah Wood, John Hurt, Leonor Watling, Julie Cox","5 wins & 5 nominations.",6.2,"tt0488604"
"White Noise 2: The Light",2007,"PG-13","05 Jan 2007",99,"Drama, Horror, Thriller","Patrick Lussier","Matt Venne","Nathan Fillion, Katee Sackhoff, Craig Fairbrass, Adrian Holmes","4 nominations.",5.8,"tt0496436"
"Fifty Dead Men Walking",2008,"R","21 Aug 2009",117,"Drama, Thriller","Kari Skogland","Martin McGartland, Kari Skogland","Ben Kingsley, Jim Sturgess, Kevin Zegers, Natalie Press","7 wins & 6 nominations.",6.9,"tt1097643"
"Adam Resurrected",2008,"R","12 Dec 2008",106,"Drama, War","Paul Schrader","Yoram Kaniuk","Jeff Goldblum, Willem Dafoe, Derek Jacobi, Ayelet Zurer","1 win.",6.3,"tt0479341"
"Adventureland",2009,"R","03 Apr 2009",107,"Comedy, Drama, Romance","Greg Mottola","Greg Mottola","Jesse Eisenberg, Kelsey Ford, Michael Zegen, Ryan McFarland","3 nominations.",6.8,"tt1091722"
"Amour",2012,"PG-13","20 Sep 2012",127,"Drama, Romance","Michael Haneke","Michael Haneke","Jean-Louis Trintignant, Emmanuelle Riva, Isabelle Huppert, Alexandre Tharaud","Won 1 Oscar. Another 54 wins & 39 nominations.",7.8,"tt1602620"
"The Lost City",2005,"R","16 Jun 2006",144,"Drama","Andy Garcia","Guillermo Cabrera Infante","Alfredo Armenteros, Danny Pino, Richard Marquez, Franklin Dominguez","2 wins & 3 nominations.",6.7,"tt0343996"
"Next Friday",2000,"R","12 Jan 2000",98,"Comedy","Steve Carr","Ice Cube, Ice Cube","Ice Cube, Mike Epps, Justin Pierce, John Witherspoon","1 nomination.",5.9,"tt0195945"
"The Runaways",2010,"R","08 Apr 2010",106,"Biography, Drama, Music","Floria Sigismondi","Floria Sigismondi","Kristen Stewart, Dakota Fanning, Michael Shannon, Stella Maeve","4 nominations.",6.6,"tt1017451"
"Gentlemen Broncos",2009,"PG-13","27 May 2010",90,"Adventure, Comedy","Jared Hess","Jared Hess, Jerusha Hess","Michael Angarano, John Baker, Robin Ballard, Steve Berg","1 nomination.",6.1,"tt1161418"
