"Title","Year","Rated","Released","Runtime","Genre","Director","Writer","Actors","Awards","imdbRating","imdbID"
"Avatar",2009,"PG-13","18 Dec 2009",162,"Action, Adventure, Fantasy","James Cameron","James Cameron","Sam Worthington, Zoe Saldana, Sigourney Weaver, Stephen Lang","Won 3 Oscars. Another 58 wins & 74 nominations.",7.9,"tt0499549"
"Pirates of the Caribbean: At World's End",2007,"PG-13","25 May 2007",169,"Action, Adventure, Fantasy","Gore Verbinski","Ted Elliott, Terry Rossio, Ted Elliott","Johnny Depp, Geoffrey Rush, Orlando Bloom, Keira Knightley","Nominated for 2 Oscars. Another 18 wins & 28 nominations.",7.1,"tt0449088"
"The Dark Knight Rises",2012,"PG-13","20 Jul 2012",165,"Action, Crime, Thriller","Christopher Nolan","Jonathan Nolan","Christian Bale, Gary Oldman, Tom Hardy, Joseph Gordon-Levitt","Nominated for 1 BAFTA Film Award. Another 28 wins & 64 nominations.",8.6,"tt1345836"
"The Lone Ranger",2013,"PG-13","03 Jul 2013",149,"Action, Adventure, Western","Gore Verbinski","Justin Haythe","Johnny Depp, Armie Hammer, William Fichtner, Tom Wilkinson","Nominated for 2 Oscars. Another 3 wins & 12 nominations.",6.6,"tt1210819"
"John Carter",2012,"PG-13","09 Mar 2012",132,"Action, Adventure, Fantasy","Andrew Stanton","Andrew Stanton","Taylor Kitsch, Lynn Collins, Samantha Morton, Willem Dafoe","1 win & 4 nominations.",6.6,"tt0401729"
"Tangled",2010,"PG","24 Nov 2010",100,"Animation, Comedy, Family","Nathan Greno, Byron Howard","Dan Fogelman","Mandy Moore, Zachary Levi, Donna Murphy, Ron Perlman","Nominated for 1 Oscar. Another 4 wins & 24 nominations.",7.9,"tt0398286"
"Spider-Man 3",2007,"PG-13","04 May 2007",139,"Action, Adventure, Fantasy","Sam Raimi","Sam Raimi","Tobey Maguire, Kirsten Dunst, James Franco, Thomas Haden Church","Nominated for 1 BAFTA Film Award. Another 1 win & 26 nominations.",6.3,"tt0413300"
"The Hobbit: An Unexpected Journey",2012,"PG-13","14 Dec 2012",169,"Adventure, Fantasy","Peter Jackson","Fran Walsh","Ian McKellen, Martin Freeman, Richard Armitage, Ken Stott","Nominated for 3 Oscars. Another 10 wins & 44 nominations.",8.1,"tt0903624"
"Harry Potter and the Half-Blood Prince",2009,"PG","15 Jul 2009",153,"Adventure, Family, Fantasy","David Yates","Steve Kloves","Daniel Radcliffe, Michael Gambon, Dave Legeno, Elarica Gallacher","Nominated for 1 Oscar. Another 7 wins & 25 nominations.",7.5,"tt0417741"
"The Hobbit: The Desolation of Smaug",2013,"PG-13","13 Dec 2013",161,"Adventure, Fantasy","Peter Jackson","Fran Walsh","Ian McKellen, Martin Freeman, Richard Armitage, Ken Stott","Nominated for 3 Oscars. Another 6 wins & 36 nominations.",8.1,"tt1170358"
"Pirates of the Caribbean: On Stranger Tides",2011,"PG-13","20 May 2011",136,"Action, Adventure, Fantasy","Rob Marshall","Ted Elliott","Johnny Depp, Penélope Cruz, Geoffrey Rush, Ian McShane","1 win & 23 nominations.",6.7,"tt1298650"
"Superman Returns",2006,"PG-13","28 Jun 2006",154,"Action, Adventure, Fantasy","Bryan Singer","Michael Dougherty","Brandon Routh, Kate Bosworth, Kevin Spacey, James Marsden","Nominated for 1 Oscar. Another 10 wins & 22 nominations.",6.2,"tt0348150"
"Quantum of Solace",2008,"PG-13","14 Nov 2008",106,"Action, Adventure, Crime","Marc Forster","Paul Haggis, Neal Purvis, Robert Wade","Daniel Craig, Olga Kurylenko, Mathieu Amalric, Judi Dench","Nominated for 2 BAFTA Film Awards. Another 4 wins & 22 nominations.",6.7,"tt0830515"
"Pirates of the Caribbean: Dead Man's Chest",2006,"PG-13","07 Jul 2006",151,"Action, Adventure, Fantasy","Gore Verbinski","Ted Elliott, Terry Rossio, Ted Elliott","Johnny Depp, Orlando Bloom, Keira Knightley, Jack Davenport","Won 1 Oscar. Another 33 wins & 37 nominations.",7.3,"tt0383574"
"Man of Steel",2013,"PG-13","14 Jun 2013",143,"Action, Adventure, Fantasy","Zack Snyder","David S. Goyer","Henry Cavill, Amy Adams, Michael Shannon, Diane Lane","5 wins & 15 nominations.",7.4,"tt0770828"
"The Chronicles of Narnia: Prince Caspian",2008,"PG","16 May 2008",150,"Action, Adventure, Family","Andrew Adamson","Andrew Adamson","Ben Barnes, Georgie Henley, Skandar Keynes, William Moseley","2 wins & 18 nominations.",6.6,"tt0499448"
"The Amazing Spider-Man",2012,"PG-13","03 Jul 2012",136,"Action, Adventure, Fantasy","Marc Webb","James Vanderbilt","Andrew Garfield, Emma Stone, Rhys Ifans, Denis Leary","3 wins & 25 nominations.",7.2,"tt0948470"
"Men in Black 3",2012,"PG-13","25 May 2012",106,"Action, Comedy, Sci-Fi","Barry Sonnenfeld","Etan Cohen, Lowell Cunningham","Will Smith, Tommy Lee Jones, Josh Brolin, Jemaine Clement","1 win & 13 nominations.",6.9,"tt1409024"
"Transformers: Revenge of the Fallen",2009,"PG-13","24 Jun 2009",150,"Action, Adventure, Sci-Fi","Michael Bay","Ehren Kruger, Roberto Orci, Alex Kurtzman","Shia LaBeouf, Megan Fox, Josh Duhamel, Tyrese Gibson","Nominated for 1 Oscar. Another 6 wins & 19 nominations.",6,"tt1055369"
"X-Men: The Last Stand",2006,"PG-13","26 May 2006",104,"Action, Adventure, Sci-Fi","Brett Ratner","Simon Kinberg, Zak Penn","Hugh Jackman, Halle Berry, Ian McKellen, Patrick Stewart","5 wins & 29 nominations.",6.8,"tt0376994"
"Robin Hood",2010,"PG-13","14 May 2010",140,"Action, Adventure, Drama","Ridley Scott","Brian Helgeland","Russell Crowe, Cate Blanchett, Max von Sydow, William Hurt","1 win & 11 nominations.",6.7,"tt0955308"
"Battleship",2012,"PG-13","18 May 2012",131,"Action, Adventure, Sci-Fi","Peter Berg","Jon Hoeber, Erich Hoeber","Taylor Kitsch, Alexander Skarsgård, Rihanna, Brooklyn Decker","3 wins & 12 nominations.",5.9,"tt1440129"
"King Kong",2005,"PG-13","14 Dec 2005",187,"Action, Adventure, Drama","Peter Jackson","Fran Walsh","Naomi Watts, Jack Black, Adrien Brody, Thomas Kretschmann","Won 3 Oscars. Another 24 wins & 51 nominations.",7.3,"tt0360717"
"The Golden Compass",2007,"PG-13","07 Dec 2007",113,"Adventure, Family, Fantasy","Chris Weitz","Chris Weitz","Nicole Kidman, Daniel Craig, Dakota Blue Richards, Ben Walker","Won 1 Oscar. Another 3 wins & 26 nominations.",6.1,"tt0385752"
"Toy Story 3",2010,"G","18 Jun 2010",103,"Animation, Adventure, Comedy","Lee Unkrich","John Lasseter","Tom Hanks, Tim Allen, Joan Cusack, Ned Beatty","Won 2 Oscars. Another 36 wins & 44 nominations.",8.5,"tt0435761"
"Iron Man 3",2013,"PG-13","03 May 2013",130,"Action, Adventure, Fantasy","Shane Black","Drew Pearce","Robert Downey Jr., Gwyneth Paltrow, Don Cheadle, Guy Pearce","Nominated for 1 Oscar. Another 13 wins & 35 nominations.",7.4,"tt1300854"
"Spider-Man 2",2004,"PG-13","30 Jun 2004",127,"Action, Fantasy","Sam Raimi","Stan Lee","Tobey Maguire, Kirsten Dunst, James Franco, Alfred Molina","Won 1 Oscar. Another 17 wins & 39 nominations.",7.4,"tt0316654"
"Alice in Wonderland",2010,"PG","05 Mar 2010",108,"Adventure, Family, Fantasy","Tim Burton","Linda Woolverton","Johnny Depp, Mia Wasikowska, Helena Bonham Carter, Anne Hathaway","Won 2 Oscars. Another 20 wins & 43 nominations.",6.5,"tt1014759"
"Skyfall",2012,"PG-13","09 Nov 2012",143,"Action, Thriller","Sam Mendes","Neal Purvis, Robert Wade, John Logan","Daniel Craig, Judi Dench, Javier Bardem, Ralph Fiennes","Won 2 Oscars. Another 40 wins & 74 nominations.",7.8,"tt1074638"
"Oz the Great and Powerful",2013,"PG","08 Mar 2013",130,"Adventure, Family, Fantasy","Sam Raimi","Mitchell Kapner","James Franco, Mila Kunis, Rachel Weisz, Michelle Williams","4 wins & 23 nominations.",6.4,"tt1623205"
"Cars 2",2011,"G","24 Jun 2011",106,"Animation, Adventure, Comedy","John Lasseter, Brad Lewis","John Lasseter","Larry the Cable Guy, Owen Wilson, Michael Caine, Emily Mortimer","Nominated for 1 Golden Globe. Another 1 win & 15 nominations.",6.4,"tt1216475"
"TRON: Legacy",2010,"PG","17 Dec 2010",125,"Action, Adventure, Sci-Fi","Joseph Kosinski","Edward Kitsis","Jeff Bridges, Garrett Hedlund, Olivia Wilde, Bruce Boxleitner","Nominated for 1 Oscar. Another 3 wins & 21 nominations.",6.9,"tt1104001"
"2012",2009,"PG-13","13 Nov 2009",158,"Action, Adventure, Sci-Fi","Roland Emmerich","Roland Emmerich, Harald Kloser","John Cusack, Amanda Peet, Chiwetel Ejiofor, Thandie Newton","4 wins & 16 nominations.",5.8,"tt1190080"
"Green Lantern",2011,"PG-13","17 Jun 2011",114,"Action, Adventure, Sci-Fi","Martin Campbell","Greg Berlanti","Ryan Reynolds, Blake Lively, Peter Sarsgaard, Mark Strong","1 win & 2 nominations.",5.7,"tt1133985"
"Transformers: Dark of the Moon",2011,"PG-13","29 Jun 2011",154,"Action, Adventure, Sci-Fi","Michael Bay","Ehren Kruger","Shia LaBeouf, Rosie Huntington-Whiteley, Josh Duhamel, John Turturro","Nominated for 3 Oscars. Another 6 wins & 27 nominations.",6.4,"tt1399103"
"Jack the Giant Slayer",2013,"PG-13","01 Mar 2013",114,"Adventure, Fantasy","Bryan Singer","Darren Lemke","Nicholas Hoult, Eleanor Tomlinson, Ewan McGregor, Stanley Tucci","2 wins & 3 nominations.",6.3,"tt1351685"
"Star Trek Into Darkness",2013,"PG-13","16 May 2013",132,"Action, Adventure, Sci-Fi","J.J. Abrams","Roberto Orci, Alex Kurtzman, Damon Lindelof, Gene Roddenberry","Chris Pine, Zachary Quinto, Zoe Saldana, Karl Urban","Nominated for 1 Oscar. Another 6 wins & 28 nominations.",7.9,"tt1408101"
"World War Z",2013,"PG-13","21 Jun 2013",116,"Action, Adventure, Horror","Marc Forster","Matthew Michael Carnahan","Brad Pitt, Mireille Enos, Daniella Kertesz, James Badge Dale","2 wins & 12 nominations.",7.1,"tt0816711"
"The Great Gatsby",2013,"PG-13","10 May 2013",143,"Drama, Romance","Baz Luhrmann","Baz Luhrmann","Lisa Adam, Frank Aldridge, Amitabh Bachchan, Steve Bisley","Won 2 Oscars. Another 35 wins & 38 nominations.",7.3,"tt1343092"
"Pacific Rim",2013,"PG-13","12 Jul 2013",132,"Action, Adventure, Sci-Fi","Guillermo del Toro","Travis Beacham","Charlie Hunnam, Diego Klattenhoff, Idris Elba, Rinko Kikuchi","Nominated for 1 BAFTA Film Award. Another 6 wins & 21 nominations.",7.1,"tt1663662"
"A Christmas Carol",2009,"PG","06 Nov 2009",96,"Animation, Comedy, Drama","Robert Zemeckis","Charles Dickens","Jim Carrey, Steve Valentine, Daryl Sabara, Sage Ryan","3 wins & 2 nominations.",6.8,"tt1067106"
"Iron Man",2008,"PG-13","02 May 2008",126,"Action, Adventure, Sci-Fi","Jon Favreau","Mark Fergus","Robert Downey Jr., Terrence Howard, Jeff Bridges, Gwyneth Paltrow","Nominated for 2 Oscars. Another 15 wins & 43 nominations.",7.9,"tt0371746"
"The Dark Knight",2008,"PG-13","18 Jul 2008",152,"Action, Crime, Drama","Christopher Nolan","Jonathan Nolan","Christian Bale, Heath Ledger, Aaron Eckhart, Michael Caine","Won 2 Oscars. Another 94 wins & 69 nominations.",9,"tt0468569"
"Indiana Jones and the Kingdom of the Crystal Skull",2008,"PG-13","22 May 2008",122,"Action, Adventure","Steven Spielberg","David Koepp","Harrison Ford, Cate Blanchett, Karen Allen, Shia LaBeouf","Nominated for 1 BAFTA Film Award. Another 6 wins & 25 nominations.",6.3,"tt0367882"
"Brave",2012,"PG","22 Jun 2012",93,"Animation, Action, Adventure","Mark Andrews, Brenda Chapman, Steve Purcell","Brenda Chapman","Kelly Macdonald, Billy Connolly, Emma Thompson, Julie Walters","Won 1 Oscar. Another 13 wins & 27 nominations.",7.2,"tt1217209"
"The Chronicles of Narnia: The Lion, the Witch and the Wardrobe",2005,"PG","09 Dec 2005",143,"Adventure, Family, Fantasy","Andrew Adamson","Ann Peacock","Georgie Henley, Skandar Keynes, William Moseley, Anna Popplewell","Won 1 Oscar. Another 14 wins & 36 nominations.",6.9,"tt0363771"
"Rush Hour 3",2007,"PG-13","10 Aug 2007",91,"Action, Comedy, Crime","Brett Ratner","Jeff Nathanson, Ross LaManna","Chris Tucker, Jackie Chan, Max von Sydow, Hiroyuki Sanada","8 nominations.",6.1,"tt0293564"
"Hugo",2011,"PG","23 Nov 2011",126,"Adventure, Drama, Family","Martin Scorsese","John Logan","Ben Kingsley, Sacha Baron Cohen, Asa Butterfield, Chloë Grace Moretz","Won 5 Oscars. Another 45 wins & 104 nominations.",7.6,"tt0970179"
"Up",2009,"PG","29 May 2009",96,"Animation, Adventure, Drama","Pete Docter, Bob Peterson","Pete Docter","Edward Asner, Christopher Plummer, Jordan Nagai, Bob Peterson","Won 2 Oscars. Another 53 wins & 37 nominations.",8.3,"tt1049413"
"Monsters vs. Aliens",2009,"PG","27 Mar 2009",94,"Animation, Action, Adventure","Rob Letterman, Conrad Vernon","Maya Forbes","Reese Witherspoon, Seth Rogen, Hugh Laurie, Will Arnett","3 wins & 8 nominations.",6.6,"tt0892782"
"G.I. Joe: The Rise of Cobra",2009,"PG-13","07 Aug 2009",118,"Action, Adventure, Sci-Fi","Stephen Sommers","Stuart Beattie","Adewale Akinnuoye-Agbaje, Christopher Eccleston, Grégory Fitoussi, Joseph Gordon-Levitt","3 wins & 11 nominations.",5.8,"tt1046173"
"The Mummy: Tomb of the Dragon Emperor",2008,"PG-13","01 Aug 2008",112,"Action, Adventure, Fantasy","Rob Cohen","Alfred Gough, Miles Millar","Brendan Fraser, Jet Li, Maria Bello, John Hannah","2 wins & 6 nominations.",5.2,"tt0859163"
"Evan Almighty",2007,"PG","22 Jun 2007",96,"Comedy, Family, Fantasy","Tom Shadyac","Steve Oedekerk","Steve Carell, Morgan Freeman, Lauren Graham, Johnny Simmons","2 wins & 10 nominations.",5.4,"tt0413099"
"47 Ronin",2013,"PG-13","25 Dec 2013",118,"Action, Adventure, Fantasy","Carl Rinsch","Chris Morgan","Keanu Reeves, Hiroyuki Sanada, Ko Shibasaki, Tadanobu Asano","3 nominations.",6.3,"tt1335975"
"Iron Man 2",2010,"PG-13","07 May 2010",124,"Action, Adventure, Sci-Fi","Jon Favreau, Kenneth Branagh","Justin Theroux","Robert Downey Jr., Gwyneth Paltrow, Don Cheadle, Scarlett Johansson","Nominated for 1 Oscar. Another 3 wins & 24 nominations.",7.1,"tt1228705"
"Thor: The Dark World",2013,"PG-13","08 Nov 2013",112,"Action, Adventure, Fantasy","Alan Taylor","Christopher Yost","Chris Hemsworth, Natalie Portman, Tom Hiddleston, Anthony Hopkins","11 nominations.",7.3,"tt1981115"
"The Polar Express",2004,"TV-PG","10 Nov 2004",100,"Animation, Adventure, Family","Robert Zemeckis","Chris Van Allsburg","Tom Hanks, Leslie Zemeckis, Eddie Deezen, Nona Gaye","Nominated for 3 Oscars. Another 5 wins & 14 nominations.",6.6,"tt0338348"
"Snow White and the Huntsman",2012,"PG-13","01 Jun 2012",127,"Adventure, Drama, Fantasy","Rupert Sanders","Evan Daugherty","Kristen Stewart, Chris Hemsworth, Charlize Theron, Sam Claflin","Nominated for 2 Oscars. Another 10 wins & 26 nominations.",6.2,"tt1735898"
"Terminator 3: Rise of the Machines",2003,"R","02 Jul 2003",109,"Action, Sci-Fi, Thriller","Jonathan Mostow","James Cameron","Arnold Schwarzenegger, Nick Stahl, Claire Danes, Kristanna Loken","2 wins & 17 nominations.",6.4,"tt0181852"
"Van Helsing",2004,"PG-13","07 May 2004",131,"Action, Adventure, Fantasy","Stephen Sommers","Stephen Sommers","Hugh Jackman, Kate Beckinsale, Richard Roxburgh, David Wenham","3 wins & 12 nominations.",5.9,"tt0338526"
"Shrek Forever After",2010,"PG","21 May 2010",93,"Animation, Adventure, Comedy","Mike Mitchell","William Steig, Josh Klausner, Darren Lemke","Mike Myers, Eddie Murphy, Cameron Diaz, Antonio Banderas","1 win & 12 nominations.",6.4,"tt0892791"
"How to Train Your Dragon",2010,"PG","26 Mar 2010",98,"Animation, Adventure, Comedy","Dean DeBlois, Chris Sanders","William Davies","Jay Baruchel, Gerard Butler, Craig Ferguson, America Ferrera","Nominated for 2 Oscars. Another 19 wins & 32 nominations.",8.2,"tt0892769"
"Wreck-It Ralph",2012,"PG","02 Nov 2012",108,"Animation, Adventure, Comedy","Rich Moore","Rich Moore","John C. Reilly, Sarah Silverman, Jack McBrayer, Jane Lynch","Nominated for 1 Oscar. Another 19 wins & 20 nominations.",7.8,"tt1772341"
"Shrek the Third",2007,"PG","18 May 2007",93,"Animation, Adventure, Comedy","Chris Miller, Raman Hui","William Steig","Mike Myers, Eddie Murphy, Cameron Diaz, Antonio Banderas","Nominated for 1 BAFTA Film Award. Another 4 wins & 13 nominations.",6,"tt0413267"
"Inception",2010,"PG-13","16 Jul 2010",148,"Action, Adventure, Mystery","Christopher Nolan","Christopher Nolan","Leonardo DiCaprio, Joseph Gordon-Levitt, Ellen Page, Tom Hardy","Won 4 Oscars. Another 83 wins & 110 nominations.",8.8,"tt1375666"
"X-Men: First Class",2011,"PG-13","03 Jun 2011",132,"Action, Adventure, Sci-Fi","Matthew Vaughn","Ashley Miller","James McAvoy, Laurence Belcher, Michael Fassbender, Bill Milner","6 wins & 17 nominations.",7.8,"tt1270798"
"The Curious Case of Benjamin Button",2008,"PG-13","25 Dec 2008",166,"Drama, Fantasy, Romance","David Fincher","Eric Roth","Cate Blanchett, Brad Pitt, Julia Ormond, Faune A. Chambers","Won 3 Oscars. Another 42 wins & 81 nominations.",7.8,"tt0421715"
"The Sorcerer's Apprentice",2010,"PG","14 Jul 2010",109,"Action, Adventure, Comedy","Jon Turteltaub","Lawrence Konner","Nicolas Cage, Jay Baruchel, Alfred Molina, Teresa Palmer","1 win & 1 nomination.",6.2,"tt0963966"
"Poseidon",2006,"PG-13","12 May 2006",98,"Action, Adventure, Drama","Wolfgang Petersen","Mark Protosevich","Josh Lucas, Kurt Russell, Jacinda Barrett, Richard Dreyfuss","Nominated for 1 Oscar. Another 5 nominations.",5.6,"tt0409182"
"The Chronicles of Narnia: The Voyage of the Dawn Treader",2010,"PG","10 Dec 2010",113,"Adventure, Family, Fantasy","Michael Apted","Christopher Markus","Georgie Henley, Skandar Keynes, Ben Barnes, Will Poulter","Nominated for 1 Golden Globe. Another 14 nominations.",6.4,"tt0980970"
"Alexander",2004,"R","24 Nov 2004",175,"Action, Adventure, Biography","Oliver Stone","Oliver Stone, Christopher Kyle, Laeta Kalogridis","Colin Farrell, Angelina Jolie, Val Kilmer, Anthony Hopkins","2 wins & 9 nominations.",5.5,"tt0346491"
"Pearl Harbor",2001,"PG-13","25 May 2001",183,"Action, Drama, Romance","Michael Bay","Randall Wallace","Ben Affleck, Josh Hartnett, Kate Beckinsale, William Lee Scott","Won 1 Oscar. Another 10 wins & 35 nominations.",5.9,"tt0213149"
"Transformers",2007,"PG-13","03 Jul 2007",144,"Action, Adventure, Sci-Fi","Michael Bay","Roberto Orci","Shia LaBeouf, Megan Fox, Josh Duhamel, Tyrese Gibson","Nominated for 3 Oscars. Another 12 wins & 30 nominations.",7.2,"tt0418279"
"Frozen",2013,"PG","27 Nov 2013",102,"Animation, Adventure, Comedy","Chris Buck, Jennifer Lee","Jennifer Lee","Kristen Bell, Idina Menzel, Jonathan Groff, Josh Gad","Won 2 Oscars. Another 35 wins & 17 nominations.",7.9,"tt2294629"
"Harry Potter and the Order of the Phoenix",2007,"PG-13","11 Jul 2007",138,"Adventure, Family, Fantasy","David Yates","Michael Goldenberg","Daniel Radcliffe, Harry Melling, Jason Boyd, Richard Macklin","Nominated for 2 BAFTA Film Awards. Another 13 wins & 32 nominations.",7.4,"tt0373889"
"Harry Potter and the Goblet of Fire",2005,"PG-13","18 Nov 2005",157,"Adventure, Family, Fantasy","Mike Newell","Steve Kloves","Eric Sykes, Timothy Spall, David Tennant, Daniel Radcliffe","Nominated for 1 Oscar. Another 10 wins & 34 nominations.",7.6,"tt0330373"
"I Am Legend",2007,"PG-13","14 Dec 2007",101,"Drama, Sci-Fi, Thriller","Francis Lawrence","Mark Protosevich, John William Corrington, Joyce Hooper Corrington","Will Smith, Alice Braga, Charlie Tahan, Salli Richardson-Whitfield","9 wins & 18 nominations.",7.2,"tt0480249"
"Hancock",2008,"PG-13","02 Jul 2008",92,"Action, Fantasy","Peter Berg","Vincent Ngo, Vince Gilligan","Will Smith, Charlize Theron, Jason Bateman, Jae Head","4 wins & 9 nominations.",6.5,"tt0448157"
"Charlie and the Chocolate Factory",2005,"PG","15 Jul 2005",115,"Adventure, Comedy, Family","Tim Burton","Roald Dahl","Johnny Depp, Freddie Highmore, David Kelly, Helena Bonham Carter","Nominated for 1 Oscar. Another 12 wins & 32 nominations.",6.8,"tt0367594"
"Ratatouille",2007,"G","29 Jun 2007",111,"Animation, Comedy, Family","Brad Bird, Jan Pinkava","Brad Bird","Patton Oswalt, Ian Holm, Lou Romano, Brian Dennehy","Won 1 Oscar. Another 46 wins & 21 nominations.",8,"tt0382932"
"Batman Begins",2005,"PG-13","15 Jun 2005",140,"Action, Crime, Thriller","Christopher Nolan","Bob Kane","Christian Bale, Michael Caine, Liam Neeson, Katie Holmes","Nominated for 1 Oscar. Another 9 wins & 44 nominations.",8.3,"tt0372784"
"Thor",2011,"PG-13","06 May 2011",115,"Action, Adventure, Fantasy","Kenneth Branagh, Joss Whedon","Ashley Miller","Chris Hemsworth, Natalie Portman, Tom Hiddleston, Anthony Hopkins","5 wins & 15 nominations.",7,"tt0800369"
"Madagascar: Escape 2 Africa",2008,"PG","07 Nov 2008",89,"Animation, Action, Adventure","Eric Darnell, Tom McGrath","Etan Cohen, Eric Darnell, Tom McGrath","Ben Stiller, Chris Rock, David Schwimmer, Jada Pinkett Smith","3 wins & 8 nominations.",6.8,"tt0479952"
"X-Men Origins: Wolverine",2009,"PG-13","01 May 2009",107,"Action, Adventure, Sci-Fi","Gavin Hood","David Benioff","Hugh Jackman, Liev Schreiber, Danny Huston, Will i Am","1 win & 12 nominations.",6.8,"tt0458525"
"Night at the Museum: Battle of the Smithsonian",2009,"PG","22 May 2009",105,"Action, Adventure, Comedy","Shawn Levy","Robert Ben Garant, Thomas Lennon, Robert Ben Garant","Ben Stiller, Amy Adams, Owen Wilson, Hank Azaria","2 wins & 8 nominations.",5.9,"tt1078912"
"Kung Fu Panda 2",2011,"PG","26 May 2011",91,"Animation, Action, Adventure","Jennifer Yuh","Jonathan Aibel, Glenn Berger","Jack Black, Angelina Jolie, Dustin Hoffman, Gary Oldman","Nominated for 1 Oscar. Another 3 wins & 26 nominations.",7.4,"tt1302011"
"Mission: Impossible III",2006,"PG-13","05 May 2006",126,"Action, Adventure, Thriller","J.J. Abrams","Alex Kurtzman, Roberto Orci, J.J. Abrams, Bruce Geller","Tom Cruise, Philip Seymour Hoffman, Ving Rhames, Billy Crudup","7 wins & 12 nominations.",6.8,"tt0317919"
"Angels & Demons",2009,"PG-13","15 May 2009",138,"Mystery, Thriller","Ron Howard","David Koepp","Tom Hanks, Ewan McGregor, Ayelet Zurer, Stellan Skarsgård","1 win & 5 nominations.",6.7,"tt0808151"
"Troy",2004,"R","14 May 2004",163,"Adventure, Drama","Wolfgang Petersen","Homer","Julian Glover, Brian Cox, Nathan Jones, Adoni Maropis","Nominated for 1 Oscar. Another 3 wins & 17 nominations.",7.2,"tt0332452"
"The Last Airbender",2010,"PG","01 Jul 2010",103,"Action, Adventure, Family","M. Night Shyamalan","M. Night Shyamalan","Noah Ringer, Dev Patel, Nicola Peltz, Jackson Rathbone","6 wins & 8 nominations.",4.4,"tt0938283"
"Bee Movie",2007,"PG","02 Nov 2007",91,"Animation, Adventure, Comedy","Steve Hickner, Simon J. Smith","Jerry Seinfeld, Spike Feresten, Barry Marder, Andy Robin, Chuck Martin","Jerry Seinfeld, Renée Zellweger, Matthew Broderick, Patrick Warburton","Nominated for 1 Golden Globe. Another 12 nominations.",6.2,"tt0389790"
"G-Force",2009,"PG","24 Jul 2009",88,"Action, Adventure, Comedy","Hoyt Yeatman","Cormac Wibberley","Bill Nighy, Will Arnett, Zach Galifianakis, Kelli Garner","1 win & 1 nomination.",5.1,"tt0436339"
"Bolt",2008,"PG","21 Nov 2008",96,"Animation, Adventure, Comedy","Byron Howard, Chris Williams","Dan Fogelman","John Travolta, Miley Cyrus, Susie Essman, Mark Walton","Nominated for 1 Oscar. Another 1 win & 21 nominations.",7,"tt0397892"
"Wrath of the Titans",2012,"PG-13","30 Mar 2012",99,"Action, Adventure, Fantasy","Jonathan Liebesman","Dan Mazeau, Beverley Cross","Sam Worthington, Liam Neeson, Ralph Fiennes, Édgar Ramírez","2 wins & 2 nominations.",5.8,"tt1646987"
"Beowulf",2007,"PG-13","16 Nov 2007",115,"Animation, Action, Adventure","Robert Zemeckis","Neil Gaiman","Robin Wright, Anthony Hopkins, Paul Baker, John Bilezikjian","1 win & 12 nominations.",6.3,"tt0442933"
"White House Down",2013,"PG-13","28 Jun 2013",131,"Action, Drama, Thriller","Roland Emmerich","James Vanderbilt","Channing Tatum, Jamie Foxx, Maggie Gyllenhaal, Jason Clarke","1 win & 7 nominations.",6.4,"tt2334879"
"The Wolfman",2010,"R","12 Feb 2010",103,"Drama, Horror, Thriller","Joe Johnston","Andrew Kevin Walker, Curt Siodmak","Simon Merrells, Gemma Whelan, Emily Blunt, Benicio Del Toro","Won 1 Oscar. Another 2 wins & 4 nominations.",5.8,"tt0780653"
"Mars Needs Moms",2011,"PG","11 Mar 2011",88,"Animation, Action, Adventure","Simon Wells","Simon Wells","Seth Green, Dan Fogler, Joan Cusack, Elisabeth Harnois","2 nominations.",5.4,"tt1305591"
"Flushed Away",2006,"PG","03 Nov 2006",85,"Animation, Adventure, Comedy","David Bowers, Sam Fell","Dick Clement","Hugh Jackman, Kate Winslet, Ian McKellen, Jean Reno","Nominated for 1 BAFTA Film Award. Another 6 wins & 11 nominations.",6.7,"tt0424095"
"Madagascar 3: Europe's Most Wanted",2012,"PG","08 Jun 2012",93,"Animation, Adventure, Comedy","Eric Darnell, Tom McGrath, Conrad Vernon","Eric Darnell","Ben Stiller, Chris Rock, David Schwimmer, Jada Pinkett Smith","1 win & 19 nominations.",7,"tt1277953"
"Mission: Impossible - Ghost Protocol",2011,"PG-13","21 Dec 2011",133,"Action, Thriller","Brad Bird","Josh Appelbaum, André Nemec, Bruce Geller","Tom Cruise, Paula Patton, Simon Pegg, Jeremy Renner","3 wins & 19 nominations.",7.4,"tt1229238"
"Rise of the Guardians",2012,"PG","21 Nov 2012",97,"Animation, Adventure, Family","Peter Ramsey","David Lindsay-Abaire","Chris Pine, Alec Baldwin, Jude Law, Isla Fisher","Nominated for 1 Golden Globe. Another 8 wins & 21 nominations.",7.3,"tt1446192"
"Sahara",2005,"PG-13","08 Apr 2005",124,"Action, Adventure, Comedy","Breck Eisner","Clive Cussler","Matthew McConaughey, Steve Zahn, Penélope Cruz, William H. Macy","2 wins & 4 nominations.",6,"tt0318649"
"Die Another Day",2002,"PG-13","22 Nov 2002",133,"Action, Adventure, Crime","Lee Tamahori","Ian Fleming, Neal Purvis, Robert Wade","Pierce Brosnan, Halle Berry, Toby Stephens, Rosamund Pike","Nominated for 1 Golden Globe. Another 5 wins & 28 nominations.",6.1,"tt0246460"
"Star Trek",2009,"PG-13","08 May 2009",127,"Action, Adventure, Sci-Fi","J.J. Abrams","Roberto Orci, Alex Kurtzman, Gene Roddenberry","Chris Pine, Zachary Quinto, Leonard Nimoy, Eric Bana","Won 1 Oscar. Another 19 wins & 47 nominations.",8.1,"tt0796366"
"Captain America: The First Avenger",2011,"PG-13","22 Jul 2011",124,"Action, Adventure, Sci-Fi","Joe Johnston","Christopher Markus","Chris Evans, Hayley Atwell, Sebastian Stan, Tommy Lee Jones","2 wins & 19 nominations.",6.8,"tt0458339"
"G.I. Joe: Retaliation",2013,"PG-13","28 Mar 2013",110,"Action, Adventure, Sci-Fi","Jon M. Chu","Rhett Reese, Paul Wernick","Dwayne Johnson, Jonathan Pryce, Byung-hun Lee, Elodie Yung","9 nominations.",5.9,"tt1583421"
"The Last Samurai",2003,"R","05 Dec 2003",154,"Action, Drama, History","Edward Zwick","John Logan","Ken Watanabe, Tom Cruise, William Atherton, Chad Lindberg","Nominated for 4 Oscars. Another 18 wins & 39 nominations.",7.7,"tt0325710"
